File,Line,InstancesCountPerLine,FeatureCountPerLine,Content,L3_L1_List,L3_L1_Tuple,CleanedL3_L1_List,CleanedL3_L1_Tuple,Count_CleanedL3_L1_Tuple,NormCount_CleanedL3_L1_Tuple,R1_R3_List,R1_R3_Tuple,CleanedR1_R3_List,CleanedR1_R3_Tuple,Count_CleanedR1_R3_Tuple,NormCount_CleanedR1_R3_Tuple,L3,Cleaned_L3,L3_Count,L3_Norm_Count,L2,Cleaned_L2,L2_Count,L2_Norm_Count,L1,Cleaned_L1,L1_Count,L1_Norm_Count,R1,Cleaned_R1,R1_Count,R1_Norm_Count,R2,Cleaned_R2,R2_Count,R2_Norm_Count,R3,Cleaned_R3,R3_Count,R3_Norm_Count
1460-138289-0003,3,2,1,sheep have broke fence said fray and got into a field of young clover said tall young clover said moon clover said joseph poorgrass and they be getting blasted said henery fray that they be said joseph,"['fray', 'that', 'they']","('fray', 'that', 'they')","['fray', 'that', 'they']","('fray', 'that', 'they')",1.0,0.010299958480867365,"['said', 'joseph', nan]","('said', 'joseph', nan)","['said', 'joseph']","('said', 'joseph')",1.0,0.010299958480867365,fray,fray,1.0,0.010299958480867365,that,that,1.0,0.010299958480867365,they,they,2.0,0.02059991696173473,said,said,1.0,0.010299958480867365,joseph,joseph,1.0,0.010299958480867365,,,2.0,0.02059991696173473
1649-150127-0042,42,1,1,e n though my trade be making of blades rather would i ha a good stout cudgel in my hand than the best dagger that ever was forged myles stood thoughtfully for a moment or two then looking up,"['though', 'my', 'trade']","('though', 'my', 'trade')","['though', 'my', 'trade']","('though', 'my', 'trade')",1.0,0.010299958480867365,"['making', 'of', 'blades']","('making', 'of', 'blades')","['making', 'of', 'blades']","('making', 'of', 'blades')",1.0,0.010299958480867365,though,though,1.0,0.010299958480867365,my,my,1.0,0.010299958480867365,trade,trade,2.0,0.02059991696173473,making,making,1.0,0.010299958480867365,of,of,1.0,0.010299958480867365,blades,blades,1.0,0.010299958480867365
2201-160438-0033,33,1,1,though the greater part of its exportation trade be carried on by foreigners the progress of our north american and west indian colonies would have been much less rapid had no capital but what belonged to themselves been employed in exporting their surplus produce,"['its', 'exportation', 'trade']","('its', 'exportation', 'trade')","['its', 'exportation', 'trade']","('its', 'exportation', 'trade')",1.0,0.010299958480867365,"['carried', 'on', 'by']","('carried', 'on', 'by')","['carried', 'on', 'by']","('carried', 'on', 'by')",1.0,0.010299958480867365,its,its,1.0,0.010299958480867365,exportation,exportation,1.0,0.010299958480867365,trade,trade,2.0,0.02059991696173473,carried,carried,1.0,0.010299958480867365,on,on,1.0,0.010299958480867365,by,by,1.0,0.010299958480867365
3479-153286-0038,38,1,1,go and search for them as if they were your own the heifers were all in the paddock before sunset next morning says the master jack the path across the bog to the pasture is very bad the sheep does be sinking in it every step,"['the', 'sheep', 'does']","('the', 'sheep', 'does')","['the', 'sheep', 'does']","('the', 'sheep', 'does')",1.0,0.010299958480867365,"['sinking', 'in', 'it']","('sinking', 'in', 'it')","['sinking', 'in', 'it']","('sinking', 'in', 'it')",1.0,0.010299958480867365,the,the,2.0,0.02059991696173473,sheep,sheep,1.0,0.010299958480867365,does,does,1.0,0.010299958480867365,sinking,sinking,1.0,0.010299958480867365,in,in,1.0,0.010299958480867365,it,it,1.0,0.010299958480867365
4712-93896-0036,36,2,1,if you engage you'll be set swede hacking that's what i be doing but you won't like it o anything will you speak for me you will do better by speaking for yourself very well now marian remember,"[""that's"", 'what', 'i']","(""that's"", 'what', 'i')","[""that's"", 'what', 'i']","(""that's"", 'what', 'i')",1.0,0.010299958480867365,"['doing', 'but', 'you']","('doing', 'but', 'you')","['doing', 'but', 'you']","('doing', 'but', 'you')",1.0,0.010299958480867365,that's,that's,1.0,0.010299958480867365,what,what,1.0,0.010299958480867365,i,i,1.0,0.010299958480867365,doing,doing,1.0,0.010299958480867365,but,but,1.0,0.010299958480867365,you,you,1.0,0.010299958480867365
5894-64095-0014,14,1,1,in such cases help can only come frae the place where they say matches be made that's heaven ha he's lookin a bit brighter what's cheerin him the boat coming back,"['they', 'say', 'matches']","('they', 'say', 'matches')","['they', 'say', 'matches']","('they', 'say', 'matches')",1.0,0.010299958480867365,"['made', ""that's"", 'heaven']","('made', ""that's"", 'heaven')","['made', ""that's"", 'heaven']","('made', ""that's"", 'heaven')",1.0,0.010299958480867365,they,they,1.0,0.010299958480867365,say,say,1.0,0.010299958480867365,matches,matches,1.0,0.010299958480867365,made,made,1.0,0.010299958480867365,that's,that's,1.0,0.010299958480867365,heaven,heaven,1.0,0.010299958480867365
6060-58090-0004,4,2,1,as indeed he would be in duty bound to do they be publicly delivered in order to set forth the confession of our faith but though the romish court is so dreadfully afraid of a free christian council,"['to', 'do', 'they']","('to', 'do', 'they')","['to', 'do', 'they']","('to', 'do', 'they')",1.0,0.010299958480867365,"['publicly', 'delivered', 'in']","('publicly', 'delivered', 'in')","['publicly', 'delivered', 'in']","('publicly', 'delivered', 'in')",1.0,0.010299958480867365,to,to,1.0,0.010299958480867365,do,do,1.0,0.010299958480867365,they,they,2.0,0.02059991696173473,publicly,publicly,1.0,0.010299958480867365,delivered,delivered,1.0,0.010299958480867365,in,in,1.0,0.010299958480867365
7134-67233-0006,6,2,1,and the pans be cleaned out daily but some feeders we are told and it seems strange limit the supply of water and substitute moistened food a piece of rock brimstone kept in the pan will be found useful,"['the', 'pan', 'will']","('the', 'pan', 'will')","['the', 'pan', 'will']","('the', 'pan', 'will')",1.0,0.010299958480867365,"['found', 'useful', nan]","('found', 'useful', nan)","['found', 'useful']","('found', 'useful')",1.0,0.010299958480867365,the,the,2.0,0.02059991696173473,pan,pan,1.0,0.010299958480867365,will,will,1.0,0.010299958480867365,found,found,1.0,0.010299958480867365,useful,useful,1.0,0.010299958480867365,,,2.0,0.02059991696173473
