File,Line,Speaker,UttStartTime,UttEndTime,UttLength,Content,AintVariation,InstancesCountPerLine,FeatureCountPerLine,WadaSNRMeade,WadaSNRRigal,NistSNRRigal
PRV_se0_ag2_f_02_1,516,PRV_se0_ag2_f_02,557.4344,559.8307,2.3963,"Princeville really didn't have  many stores,",didn't,1,0,4.361857123,4.23,4.75
PRV_se0_ag2_f_02_1,620,PRV_int_03,670.8545,673.2742,2.4197,So they didn't get much at the end of the year cause they had to-,didn't,1,0,-3.440705795,-3.65,5
PRV_se0_ag2_f_02_1,863,PRV_se0_ag2_f_02,954.4424,955.3282,0.8858,c- school really didn't,didn't,1,0,4.262615249,4.17,5.5
PRV_se0_ag2_f_02_1,883,PRV_se0_ag2_f_02,976.7269,980.8351,4.1082,we didn't start school at a certain time. It was like the fifteenth of September.,didn't,1,0,1.367700866,1.29,6
PRV_se0_ag2_f_02_1,1263,PRV_se0_ag2_f_02,1383.927,1386.2813,2.3543,a lot of time we didn't- couldn't afford all different stuff.,didn't,1,0,5.10489514,5.08,9.5
PRV_se0_ag2_f_02_1,1324,PRV_se0_ag2_f_02,1439.1684,1440.3645,1.1961,I didn't like that bike. ,didn't,1,0,7.900623372,7.9,10.75
PRV_se0_ag2_f_02_1,1333,PRV_se0_ag2_f_02,1447.4315,1453.0769,5.6454,"I- I didn't try it anymore, a- but my sister and brother, they love it. But I didn't like that bike",didn't,2,0,9.234793556,9.22,9.25
PRV_se0_ag2_f_02_1,1392,PRV_se0_ag2_f_02,1514.0895,1514.7135,0.624,They didn't have the-,didn't,1,0,5.685320964,5.61,7.75
PRV_se0_ag2_f_02_1,1713,PRV_se0_ag2_f_02,1830.0795,1833.0318,2.9523,"Yeah. And you know what, they didn't have automatic buses then.",didn't,1,0,6.434626121,6.41,6
PRV_se0_ag2_f_02_1,1731,PRV_se0_ag2_f_02,1851.1901,1854.5636,3.3735,"failed the first test, and then I tried again. I said, I'm not gonna",I'm not,1,0,5.780342536,5.72,9
PRV_se0_ag2_f_02_1,1786,PRV_se0_ag2_f_02,1913.3703,1915.8673,2.497,if they didn't it was from the first grade til the-,didn't,1,0,3.137309763,2.99,6.5
PRV_se0_ag2_f_02_1,2029,PRV_se0_ag2_f_02,2168.692,2171.6892,2.9972,if I'm not mistaken- I don't think Princeville School was,I'm not,1,0,6.461293799,6.32,6.75
PRV_se0_ag2_f_02_1,2071,PRV_se0_ag2_f_02,2216.6114,2219.323,2.7116,they was invited. They didn't even have to get invited. ,didn't,1,0,8.722002816,8.71,13
PRV_se0_ag2_f_02_1,2091,PRV_se0_ag2_f_02,2243.635,2245.043,1.408,"it didn't matter how it looked,",didn't,1,0,9.543100792,9.53,5.75
PRV_se0_ag2_f_02_1,2219,PRV_se0_ag2_f_02,2372.6238,2375.0423,2.4185,"I said, I know this ain't gonna be for me all my life, I-",ain't,1,1,2.062792486,2.01,4.5
PRV_se0_ag2_f_02_1,2298,PRV_se0_ag2_f_02,2443.1919,2445.4903,2.2984,"well I was married to a RD-NAME-2, so I'm not related.",I'm not,1,0,7.955837573,7.93,14
PRV_se0_ag2_f_02_1,2320,PRV_se0_ag2_f_02,2464.4457,2467.9045,3.4588,"better with my life than to work on the farm. I said, I didn't wanna quit because",didn't,1,0,0.937449868,0.9,5.75
PRV_se0_ag2_f_02_1,2397,PRV_se0_ag2_f_02,2530.5643,2531.5649,1.0006,if one thing didn't,didn't,1,0,0.263409735,0.2,5.25
PRV_se0_ag2_f_02_2,396,PRV_se0_ag2_f_02,499.1842,501.6075,2.4233,"It- it- it haven't been that many preachers there, uh,",haven't,1,0,4.583391546,4.5,7.25
PRV_se0_ag2_f_02_2,739,PRV_se0_ag2_f_02,921.8891,923.1466,1.2575,it didn't appear to be no-,didn't,1,0,4.167208171,4.13,5.75
PRV_se0_ag2_f_02_2,747,PRV_se0_ag2_f_02,926.5749,928.3367,1.7618,"some of that day, but I didn't know it was",didn't,1,0,11.23213734,11.2,7.75
PRV_se0_ag2_f_02_2,771,PRV_se0_ag2_f_02,956.5289,957.4721,0.9432,We didn't hear nothing.,didn't,1,0,2.604480013,2.55,3.75
PRV_se0_ag2_f_02_2,773,PRV_se0_ag2_f_02,957.8205,959.0617,1.2412,We didn't know nothing.,didn't,1,0,9.473758979,9.44,17.25
PRV_se0_ag2_f_02_2,793,PRV_se0_ag2_f_02,981.5886,988.9875,7.3989,"And I called her, holler at my mom, that my mom was in the kitchen though. She was up. But she didn't notice nothing. She was in the kitchen cooking breakfast.",didn't,1,0,7.105664765,7.05,6.5
PRV_se0_ag2_f_02_2,862,PRV_se0_ag2_f_02,1072.4829,1074.5539,2.071,So y'all didn't- cause they was staying in Princeville too.,didn't,1,0,7.381962006,7.35,9.25
PRV_se0_ag2_f_02_2,1009,PRV_se0_ag2_f_02,1234.9427,1238.8119,3.8692,"well you walk back the water gonna still come together, see all them haven't had come together",haven't,1,0,4.00360822,3.93,6.5
PRV_se0_ag2_f_03_1,117,PRV_se0_ag2_f_03,158.5868,162.4378,3.851,and I was praying to the Lord that he didn't try to jump out of there cause I was so scared. Me and my husband.,didn't,1,0,12.33613682,12.31,5
PRV_se0_ag2_f_03_1,218,PRV_se0_ag2_f_03,283.2751,285.3322,2.0571,"It ain't never been a big town, no way.",ain't,1,1,9.668248756,9.58,3.75
PRV_se0_ag2_f_03_1,228,PRV_se0_ag2_f_03,298.222,302.0798,3.8578,"Mm-hm. Where that at? You know, people that, you know, ain't never been- you know, heard nothing about Princeville.",ain't,1,1,12.40037174,12.37,4.75
PRV_se0_ag2_f_03_1,343,PRV_se0_ag2_f_03,467.448,470.5721,3.1241,"No, there ain't any- I ain't into that- without- you know- no.",ain't,2,2,12.87672136,12.72,6.25
PRV_se0_ag2_f_03_1,349,PRV_se0_ag2_f_03,481.8668,484.5865,2.7197,I might go back to work if they ain't- you know-,ain't,1,1,7.884458165,7.83,8.25
PRV_se0_ag2_m_01_1,73,PRV_se0_ag2_m_01,61.4428,64.3618,2.919,"Georgia. Didn't stay in Georgia long, then we lived um, New Jersey.",didn't,1,0,13.49969594,13.42,7
PRV_se0_ag2_m_01_1,209,PRV_se0_ag2_m_01,184.0866,185.313,1.2264,"that was busted, but didn't know it,",didn't,1,0,6.995109484,6.96,4.75
PRV_se0_ag2_m_01_1,536,PRV_se0_ag2_m_01,448.9764,450.8542,1.8778,"Instead of just, you know, when I didn't understand something,",didn't,1,0,11.30088905,11.27,5.75
PRV_se0_ag2_m_01_1,560,PRV_se0_ag2_m_01,470.937,471.7882,0.8512,"you know, or I didn't.",didn't,1,0,13.63054258,13.54,14.75
PRV_se0_ag2_m_01_1,570,PRV_se0_ag2_m_01,477.9172,480.4196,2.5024,"But when I ask for it, I try to ask for it when it ain't nobody around. Cause like I said",ain't,1,1,12.3956535,12.34,5.75
PRV_se0_ag2_m_01_1,718,PRV_se0_ag2_m_01,602.7437,603.5551,0.8114,"No, I'm not kin to her.",I'm not,1,0,8.882859117,8.84,7.5
PRV_se0_ag2_m_01_1,1263,PRV_se0_ag2_m_01,1061.8381,1062.3277,0.4896,No I didn't-,didn't,1,0,7.943877906,7.93,5.5
PRV_se0_ag2_m_01_1,1265,PRV_se0_ag2_m_01,1062.4956,1063.2557,0.7601,I didn't go to college.,didn't,1,0,7.313113844,7.26,3
PRV_se0_ag2_m_01_1,1318,PRV_se0_ag2_m_01,1113.1581,1114.93,1.7719,"haven't even been there a month yet, and I'm tryna learn-",haven't,1,0,8.620132985,8.57,3.5
PRV_se0_ag2_m_01_1,1362,PRV_se0_ag2_m_01,1153.2557,1154.0996,0.8439,And I haven't been there,haven't,1,0,9.237560435,9.2,3
PRV_se0_ag2_m_01_1,1462,PRV_se0_ag2_m_01,1249.4235,1250.8644,1.4409,Some mornings we ain't leave is,ain't,1,1,9.459243415,9.41,2.5
PRV_se0_ag2_m_01_1,1515,PRV_se0_ag2_m_01,1303.7509,1304.7115,0.9606,handwriting didn't look right.,didn't,1,0,6.292950412,6.27,7.5
PRV_se0_ag2_m_01_1,1517,PRV_se0_ag2_m_01,1305.5834,1306.4061,0.8227,So I ain't say nothing.,ain't,1,1,9.889995741,9.83,3.25
PRV_se0_ag2_m_01_1,1656,PRV_se0_ag2_m_01,1438.4694,1441.338,2.8686,"I didn't go to college. They probably went to college. You know, this and that, so.",didn't,1,0,10.54146195,10.5,6.25
PRV_se0_ag2_m_01_1,2039,misc,1795.0177,1797.0525,2.0348,"We didn't play for high school, we just  a team.",didn't,1,0,12.99649947,12.96,14
PRV_se0_ag2_m_01_1,2066,PRV_se0_ag2_m_01,1811.6748,1812.2484,0.5736,I ain't say nothing.,ain't,1,1,5.764421525,5.72,4.5
PRV_se0_ag2_m_01_1,2068,PRV_se0_ag2_m_01,1813.3255,1813.7498,0.4243,I ain't say nothing.,ain't,1,1,8.798321287,8.77,14
PRV_se0_ag2_m_01_1,2407,PRV_se0_ag2_m_01,2107.3215,2107.979,0.6575,"you know, basically ain't",ain't,1,1,10.56818065,10.48,5.75
PRV_se0_ag2_m_01_1,2436,PRV_se0_ag2_m_01,2135.9273,2136.6408,0.7135,they didn't have,didn't,1,0,20.44782576,20.32,32.25
PRV_se0_ag2_m_01_1,2603,PRV_se0_ag2_m_01,2289.0888,2290.5483,1.4595,"And after I was just getting in, and I didn't have a",didn't,1,0,11.91044943,11.86,4
PRV_se0_ag2_m_01_1,2691,PRV_se0_ag2_m_01,2351.3258,2352.0486,0.7228,Ain't no way I can volunt-,ain't,1,1,12.18688097,12.12,4.25
PRV_se0_ag2_m_01_1,2748,PRV_se0_ag2_m_01,2399.9833,2401.4661,1.4828,"I didn't know how to put in, know, fire reports.",didn't,1,0,11.80774427,11.74,17
PRV_se0_ag2_m_01_1,2994,PRV_se0_ag2_m_01,2619.3313,2620.6322,1.3009,I'm not gonna let you go this class,I'm not,1,0,14.0113731,13.93,17
PRV_se0_ag2_m_01_1,3028,PRV_se0_ag2_m_01,2650.3431,2652.4822,2.1391,"I mean, I'm thirty two years old and I'm not gonna back talk my mom.",I'm not,1,0,11.96614541,11.92,7
PRV_se0_ag2_m_01_1,3035,PRV_se0_ag2_m_01,2657.5683,2658.5895,1.0212,You want me to- I'm not gonna do it.,I'm not,1,0,9.277768462,9.22,4.75
PRV_se0_ag2_m_01_1,3043,PRV_se0_ag2_m_01,2665.2563,2667.0422,1.7859,I'm going outside. I ain't got- I ain't got nothing to do with it.,ain't,2,2,9.113341578,9.06,6
PRV_se0_ag2_m_01_1,3045,PRV_se0_ag2_m_01,2667.7416,2668.3384,0.5968,I didn't do it.,didn't,1,0,7.872013624,7.85,2.25
PRV_se0_ag2_m_02_1,250,PRV_se0_ag2_m_02,260.4439,264.4086,3.9647,"It was a real real old store. After the flood, he didn't- he didn't reopen after the flood.",didn't,2,0,12.27274351,12.15,9.5
PRV_se0_ag2_m_02_1,253,PRV_se0_ag2_m_02,265.6819,268.1413,2.4594,"Yeah, he didn't reopen, but it's the building right here beside.",didn't,1,0,10.03066725,9.87,10.75
PRV_se0_ag2_m_02_1,301,PRV_se0_ag2_m_02,314.6617,317.2583,2.5966,"uh, and basketball court now that we didn't have then.",didn't,1,0,9.896208399,9.83,10
PRV_se0_ag2_m_02_1,333,PRV_se0_ag2_m_02,353.9968,355.9414,1.9446,"heck, now you got a carwash you didn't have before.",didn't,1,0,12.88551981,12.8,7.25
PRV_se0_ag2_m_02_1,342,PRV_se0_ag2_m_02,365.85,369.2297,3.3797,They didn't bring that back but we're gonna get a park out there sponsored by Lowe's.,didn't,1,0,10.19347984,10.11,5
PRV_se0_ag2_m_02_1,463,PRV_se0_ag2_m_02,495.022,496.7356,1.7136,No I didn't. When I went it was integrated.,didn't,1,0,11.71682519,11.66,10.5
PRV_se0_ag2_m_02_1,576,PRV_se0_ag2_m_02,609.5759,615.2635,5.6876,"I didn't really know what I was participating in but I knew when I got there what the rally was all about. You know, so I didn't- I weren't",didn't,2,0,9.75773742,9.75,8
PRV_se0_ag2_m_02_1,652,PRV_se0_ag2_m_02,698.4777,702.6621,4.1844,"You know?  I mean, I was a playing type guy so it- it- it didn't really- it didn't really matter to me.",didn't,2,0,13.21236186,13.19,8.25
PRV_se0_ag2_m_02_1,769,PRV_se0_ag2_m_02,815.9047,817.4799,1.5752,you either heard the fire whistle or you didn't hear it.,didn't,1,0,12.56578816,12.52,8.25
PRV_se0_ag2_m_02_1,771,PRV_se0_ag2_m_02,817.8786,820.1077,2.2291,"And if you didn't hear it as a fireman, you probably",didn't,1,0,10.60498394,10.47,10.25
PRV_se0_ag2_m_02_1,773,PRV_se0_ag2_m_02,820.2669,820.9438,0.6769,didn't respond.,didn't,1,0,10.55142498,10.32,13.25
PRV_se0_ag2_m_02_1,1041,PRV_se0_ag2_m_02,1129.0123,1133.4077,4.3954,"Yeah, yeah, just you know, a little knee high water that go away but that didn't go away.",didn't,1,0,7.241661689,7.2,5.75
PRV_se0_ag2_m_02_1,1082,PRV_se0_ag2_m_02,1177.8265,1179.893,2.0665,And didn't take the- didn't take the leaving seriously.,didn't,2,0,6.12355194,5.97,8.25
PRV_se0_ag2_m_02_1,1200,PRV_se0_ag2_m_02,1311.8078,1312.5334,0.7256,We didn't know that.,didn't,1,0,5.473318537,5.35,4.5
PRV_se0_ag2_m_02_1,1202,PRV_se0_ag2_m_02,1312.9817,1314.0704,1.0887,"You know, we didn't know that.",didn't,1,0,0.88821103,0.43,3.25
PRV_se0_ag2_m_02_1,1235,PRV_se0_ag2_m_02,1352.3424,1354.4279,2.0855,That there was already flooded and we didn't even know it.,didn't,1,0,8.688087454,8.63,13
PRV_se0_ag2_m_02_1,1239,PRV_se0_ag2_m_02,1356.9508,1358.6028,1.652,"Surrounding us, and we didn't even realize that.",didn't,1,0,6.76330137,6.73,3.75
PRV_se0_ag2_m_02_1,1293,PRV_se0_ag2_m_02,1419.8977,1421.2468,1.3491,You know so we didn't take anything.,didn't,1,0,7.710046992,7.65,8.75
PRV_se0_ag2_m_02_1,1315,PRV_se0_ag2_m_02,1440.8987,1443.1925,2.2938,Cause they didn't actually see the water in their yard.,didn't,1,0,8.762415594,8.71,8.75
PRV_se0_ag2_m_02_1,1341,PRV_se0_ag2_m_02,1470.8135,1473.0856,2.2721,So they didn't take any chances cause they was right there on the river.,didn't,1,0,12.72407837,12.67,6.75
PRV_se0_ag2_m_02_1,1369,PRV_se0_ag2_m_02,1493.881,1494.6053,0.7243,didn't know,didn't,1,0,12.08539143,12.07,26.75
PRV_se0_ag2_m_02_1,1488,PRV_se0_ag2_m_02,1643.6065,1648.3517,4.7452,"You know, so we saw that and we asked them- I asked them, I said why didn't y'all call us? They said the phones weren't working.",didn't,1,0,12.03311827,11.94,8.5
PRV_se0_ag2_m_02_1,1521,PRV_se0_ag2_m_02,1681.9922,1685.1994,3.2072,but we didn't realize it was water up here to our waist and chest everywhere-,didn't,1,0,11.4239333,11.34,6
PRV_se0_ag2_m_02_1,1525,PRV_se0_ag2_m_02,1685.8716,1689.3061,3.4345,didn't think twice. We just wanted rescue those people. Didn't think  how-,didn't,2,0,12.77862285,12.69,12.5
PRV_se0_ag2_m_02_1,1617,PRV_se0_ag2_m_02,1792.2007,1795.5567,3.356,But that dyke has been raised if I'm not mistaken quite a few feet,I'm not,1,0,10.46334275,10.3,10.75
PRV_se0_ag2_m_02_1,1691,PRV_se0_ag2_m_02,1876.1912,1878.7899,2.5987,"yesterday, just didn't look like that and today it's just like,",didn't,1,0,9.618155217,9.57,5
PRV_se0_ag2_m_02_1,1783,PRV_se0_ag2_m_02,1983.5995,1987.8359,4.2364,"You know, cause I don't think we- they didn't enter into the buyout program to decide to come back. So either",didn't,1,0,9.712623268,9.64,9.25
PRV_se0_ag2_m_02_1,1798,PRV_se0_ag2_m_02,2000.8611,2003.5734,2.7123,"You know, so you ain't look like the flood just never happened.",ain't,1,1,5.801379876,5.63,6
PRV_se0_ag2_m_02_1,1907,PRV_se0_ag2_m_02,2127.6469,2131.3957,3.7488,"Uh, Tarboro don't have it so much land for you to go to and a lot just 'em didn't wanna leave.",didn't,1,0,8.238169642,8.16,9
PRV_se0_ag2_m_02_1,1909,PRV_se0_ag2_m_02,2131.7318,2136.6147,4.8829,"I hear a lot of people say well call the job, you know, closer to their job, they didn't wanna go to another town, so",didn't,1,0,10.1009197,10.01,9
PRV_se0_ag2_m_02_1,2046,PRV_se0_ag2_m_02,2288.2951,2293.8028,5.5077,"this and town is oldest this and that and started saying, what do you mean the oldest? Cause I didn't know that. You know, so if you're the oldest",didn't,1,0,10.69858513,10.62,9.5
PRV_se0_ag2_m_02_1,2183,misc,2441.4284,2442.3733,0.9449,It hasn't been that long.,hasn't,1,0,0.998142473,0.25,3.25
PRV_se0_ag2_m_02_1,2355,misc,2621.2554,2623.3683,2.1129,Ninety-seven- ninety-six. It was ninety-six isn't it?,isn't,1,0,11.9591925,11.95,18.5
PRV_se0_ag2_m_02_2,76,misc,94.3681,95.7685,1.4004,I'm not- inaudible,I'm not,1,0,12.99460557,12.97,12.75
PRV_se0_ag2_m_02_2,451,PRV_se0_ag2_m_02,445.0256,447.6936,2.668,Cause we didn't lose anything in that- in that aspect whatsoever.,didn't,1,0,7.262883429,6.97,7
PRV_se0_ag2_m_02_2,565,PRV_se0_ag2_m_02,565.6087,567.3566,1.7479,"I didn't go there. Uh, I was",didn't,1,0,11.85816156,11.82,8.25
PRV_se0_ag2_m_02_2,571,PRV_se0_ag2_m_02,570.3292,571.8574,1.5282,didn't have to work ,didn't,1,0,14.91207919,14.9,14.75
PRV_se0_ag2_m_02_2,575,PRV_se0_ag2_m_02,574.2393,576.6158,2.3765,So I didn't know what it's like until I really got hired at,didn't,1,0,7.995017043,7.92,6.75
PRV_se0_ag3_f_01_1,195,PRV_se0_ag3_f_01,222.5392,223.6327,1.0935,this isn't for me.,isn't,1,0,19.34124967,19.18,30.25
PRV_se0_ag3_f_01_1,249,PRV_se0_ag3_f_01,301.436,304.719,3.283,"he said, you aren't gonna cry are you? I says, no I'm not gonna cry.",I'm not,1,0,12.47025417,12.4,3.25
PRV_se0_ag3_f_01_1,249,PRV_se0_ag3_f_01,301.436,304.719,3.283,"he said, you aren't gonna cry are you? I says, no I'm not gonna cry.",aren't,1,0,12.47025417,12.4,3.25
PRV_se0_ag3_f_01_1,251,PRV_se0_ag3_f_01,305.235,310.1131,4.8781,"I said- he said, well did you hurt yourself? I says, no I'm not hurting. It's just- I'm embarrassed.",I'm not,1,0,20.28224126,20.17,28.75
PRV_se0_ag3_f_01_1,267,PRV_se0_ag3_f_01,330.6408,332.7566,2.1158,"He says, well you know what, if you aren't hurt,",aren't,1,0,8.580311777,8.51,7.75
PRV_se0_ag3_f_01_1,674,PRV_se0_ag3_f_01,776.5219,779.1138,2.5919,"So she didn't allow it- when sh- when the water came up,",didn't,1,0,17.05463292,16.97,30.25
PRV_se0_ag3_f_01_1,966,PRV_se0_ag3_f_01,1139.2774,1140.7002,1.4228,they didn't treat me that way.,didn't,1,0,15.89680212,15.77,25.25
PRV_se0_ag3_f_01_1,1073,PRV_se0_ag3_f_01,1270.6384,1275.6302,4.9918,"surrounding of kids, but I was a secretary. I didn't have any direct contact with them.",didn't,1,0,18.90403448,18.78,30.5
PRV_se0_ag3_f_01_1,1498,PRV_se0_ag3_f_01,1800.101,1803.3556,3.2546,And I woulda been in the wrong. So today I'm happy I didn't touch her.,didn't,1,0,16.92447413,16.85,5
PRV_se0_ag3_f_01_1,1518,PRV_se0_ag3_f_01,1817.6845,1821.2941,3.6096,I- I guess it played on my conscious that I didn't get her out and,didn't,1,0,18.22858187,18.1,28.75
PRV_se0_ag3_f_01_1,1522,PRV_se0_ag3_f_01,1825.0594,1827.1284,2.069,I didn't get to see any of my people.,didn't,1,0,18.95729438,18.76,28.5
PRV_se0_ag3_f_01_1,1696,PRV_se0_ag3_f_01,2049.8148,2051.0076,1.1928,And I didn't realize it,didn't,1,0,17.31884986,17.2,28.75
PRV_se0_ag3_f_01_1,1708,PRV_se0_ag3_f_01,2062.7189,2065.4481,2.7292,it still didn't dawn on me until they brought my piano out,didn't,1,0,12.45211362,12.38,26.25
PRV_se0_ag3_f_01_1,1740,PRV_se0_ag3_f_01,2112.5223,2113.964,1.4417,"And I told her, I didn't know.",didn't,1,0,19.56452789,19.47,31.25
PRV_se0_ag3_f_01_1,1742,PRV_se0_ag3_f_01,2114.1675,2115.1,0.9325,I just didn't know.,didn't,1,0,22.25367987,22.08,27.25
PRV_se0_ag3_f_01_1,1820,PRV_se0_ag3_f_01,2208.9794,2210.3237,1.3443,I didn't know anything-,didn't,1,0,9.796241014,9.71,30.5
PRV_se0_ag3_f_01_1,1822,PRV_se0_ag3_f_01,2212.0609,2214.882,2.8211,I didn't know any place else but Princeville.,didn't,1,0,25.6440108,25.49,31.75
PRV_se0_ag3_f_01_1,2238,PRV_se0_ag3_f_01,2725.8409,2728.4396,2.5987,brain dead so I'm not doing anything right now.,I'm not,1,0,12.89665444,12.85,7.5
PRV_se0_ag3_f_01_2,141,PRV_se0_ag3_f_01,184.9599,187.0627,2.1028,He didn't want me to call people in to help,didn't,1,0,18.16305975,18.06,9
PRV_se0_ag3_f_01_2,158,PRV_se0_ag3_f_01,204.1492,206.8126,2.6634,"if that flood didn't teach somebody something,",didn't,1,0,24.00759719,23.85,30.5
PRV_se0_ag3_f_01_2,287,PRV_se0_ag3_f_01,399.8315,405.616,5.7845,"and you had to make the first move to show them they had to be strong and come back. I said, yeah I did, didn't I?",didn't,1,0,17.47987973,17.35,6
PRV_se0_ag3_f_01_2,307,PRV_se0_ag3_f_01,433.9302,436.5481,2.6179,because I didn't know what might come through the line.,didn't,1,0,17.71719988,17.61,5
PRV_se0_ag3_f_01_2,468,PRV_se0_ag3_f_01,662.4676,665.0076,2.54,that didn't at one time exist.,didn't,1,0,22.04223391,21.88,11.5
PRV_se0_ag3_f_02_1,73,PRV_se0_ag3_f_02,89.8748,94.0544,4.1796,She was a very outspoken person  she didn't stand any mess.,didn't,1,0,22.87555138,22.66,31.5
PRV_se0_ag3_f_02_1,378,PRV_se0_ag3_f_02,451.5777,453.8624,2.2847,"over there and that's really amazing, isn't it?",isn't,1,0,12.78846296,12.7,6.75
PRV_se0_ag3_f_02_1,615,PRV_se0_ag3_f_02,729.6314,731.2379,1.6065,No I didn't want him to come.,didn't,1,0,14.08476962,13.99,14.5
PRV_se0_ag3_f_02_1,633,PRV_se0_ag3_f_02,748.0848,750.1315,2.0467,The doctor didn't know what he was talking about.,didn't,1,0,23.26945323,23.06,27.5
PRV_se0_ag3_f_02_1,682,PRV_se0_ag3_f_02,798.3088,801.1468,2.838,"test it out and everything, it didn't last very long.",didn't,1,0,13.70435436,13.61,31.5
PRV_se0_ag3_f_02_1,717,PRV_se0_ag3_f_02,841.8153,846.2731,4.4578,"we didn't have uh, wooden floor in that church. It was a cement block building.",didn't,1,0,17.49483657,17.36,23
PRV_se0_ag3_f_02_1,755,PRV_se0_ag3_f_02,891.0002,891.894,0.8938,So it didn't,didn't,1,0,11.76809901,11.72,12.75
PRV_se0_ag3_f_02_1,1065,misc,1259.1837,1260.6849,1.5012,He didn't tell you he was a Platter did he?,didn't,1,0,13.0007578,12.93,16.5
PRV_se0_ag3_f_02_1,1626,PRV_se0_ag3_f_02,1891.7079,1893.0579,1.35,I didn't think it was,didn't,1,0,13.04631803,12.98,7.25
PRV_se0_ag3_f_02_1,1936,PRV_se0_ag3_f_02,2257.4087,2260.5838,3.1751,"the fourteenth if I'm not mistaken, fourteenth or fifteenth",I'm not,1,0,30.10392259,29.79,31.5
PRV_se0_ag3_f_02_1,1980,PRV_se0_ag3_f_02,2311.2337,2312.623,1.3893,I'm not gonna be a part of it.,I'm not,1,0,12.02649874,11.92,4.5
PRV_se0_ag3_f_02_1,2062,PRV_se0_ag3_f_02,2396.1016,2397.0516,0.95,"And I'm not a uh,",I'm not,1,0,11.73881691,11.67,3.5
PRV_se0_ag3_f_02_1,2310,PRV_se0_ag3_f_02,2690.1194,2693.2616,3.1422,"you know, it's really strange people didn't know that all of this",didn't,1,0,17.44757654,17.34,28.5
PRV_se0_ag3_f_02_2,101,misc,134.8125,139.2196,4.4071,"Hey that sounds like like your neighbor. One neighbor right there, he ain't been- he ain't- he ain't never lived here.",ain't,3,3,4.514276884,4,5.25
PRV_se0_ag3_f_02_2,386,PRV_se0_ag3_f_02,460.5728,463.207,2.6342,and right now I haven't heard from RD-NAME-1,haven't,1,0,11.73158399,11.65,32.5
PRV_se0_ag3_f_02_2,388,PRV_se0_ag3_f_02,463.5533,466.1767,2.6234,"previously but I see they came by, they didn't close it.",didn't,1,0,17.51307581,17.4,30
PRV_se0_ag3_f_02_2,392,PRV_se0_ag3_f_02,470.1792,471.391,1.2118,But they didn't close it up.,didn't,1,0,15.22007648,15.08,7.5
PRV_se0_ag3_f_02_2,411,PRV_se0_ag3_f_02,499.3169,501.088,1.7711,So it- it isn't a problem,isn't,1,0,22.04198587,21.87,28.5
PRV_se0_ag3_f_02_2,442,PRV_se0_ag3_f_02,533.1263,534.2449,1.1186,They didn't know this.,didn't,1,0,12.98873712,12.88,5.5
PRV_se0_ag3_f_02_2,450,PRV_se0_ag3_f_02,539.9919,541.1038,1.1119,we just haven't s-,haven't,1,0,25.16524726,24.99,29.75
PRV_se0_ag3_f_02_2,1191,PRV_se0_ag3_f_02,1461.2481,1467.8196,6.5715,"I said I- we haven't heard a thing but we heard uh, the fire trucks going down here keep going down to um,",haven't,1,0,15.41389186,15.3,29.75
PRV_se0_ag3_f_02_2,1216,PRV_se0_ag3_f_02,1495.311,1497.7843,2.4733,"so he said, I'm not gonna stay I'm going back home.",I'm not,1,0,13.19842216,13.14,4.75
PRV_se0_ag3_f_02_2,1290,PRV_se0_ag3_f_02,1594.712,1596.3496,1.6376,You see but a lot of people didn't.,didn't,1,0,20.60589049,20.43,22.25
PRV_se0_ag3_f_02_2,1294,PRV_se0_ag3_f_02,1604.3987,1608.4375,4.0388,he didn't know that the water was rising that high out there,didn't,1,0,7.882785412,7.83,4.5
PRV_se0_ag3_f_02_2,1337,PRV_se0_ag3_f_02,1668.1074,1671.1696,3.0622,But I didn't hear of anybody getting drowneded,didn't,1,0,19.28578955,19.15,4
PRV_se0_ag3_f_02_2,1444,PRV_se0_ag3_f_02,1803.3902,1806.8531,3.4629,I still didn't wanna stay in there because it wasn't safe.,didn't,1,0,23.73748595,23.53,28
PRV_se0_ag3_f_03_1,40,PRV_se0_ag3_f_03,49.4414,51.9947,2.5533,"I didn't wanna leave, but know, had to come back and help my dad out.",didn't,1,0,16.30852669,16.23,12
PRV_se0_ag3_f_03_1,196,PRV_se0_ag2_f_03,229.5806,230.6788,1.0982,See I'm not a RD-NAME-3.,I'm not,1,0,7.313443788,7.28,14.25
PRV_se0_ag3_f_03_1,233,PRV_se0_ag3_f_03,258.6502,262.6952,4.045,Well see it didn't flood East Tarboro. It flooded just Princeville and we had to get a- you know a little,didn't,1,0,17.73644262,17.67,6.75
PRV_se0_ag3_f_03_1,264,PRV_se0_ag3_f_03,287.1497,289.914,2.7643,Now that's was something I didn't- I couldn't understand.,didn't,1,0,14.95279231,14.85,6.75
PRV_se0_ag3_f_03_1,301,PRV_se0_ag3_f_03,333.0527,335.8029,2.7502,"Yeah cause at that time, I can't- at night. See, didn't nobody tel-",didn't,1,0,13.84318635,13.79,5
PRV_se0_ag3_f_03_1,336,PRV_se0_ag3_f_03,384.1484,387.687,3.5386,"Ain't got nowhere to get. My water's coming. I said, wait a minute. I can't get out myself.",ain't,1,1,11.12714276,11.07,5.25
PRV_se0_ag3_f_03_1,349,PRV_se0_ag3_f_03,402.617,405.3983,2.7813,"and I didn't see her. I said, oh Lord. That girl's still in the house over there.",didn't,1,0,12.38111874,12.28,6.5
PRV_se0_ag3_f_03_1,480,PRV_se0_ag2_f_03,554.0022,557.4083,3.4061,Ain't nobody came and evacuated us and told us to get out of the home or nothing.,ain't,1,1,10.99125024,10.94,5
PRV_se0_ag3_f_03_1,482,PRV_se0_ag2_f_03,557.8011,560.4187,2.6176,"And we didn't- if they did, we didn't hear them. They didn't tell us nothing.",didn't,3,0,9.402746495,9.37,5.5
PRV_se0_ag3_f_03_1,556,PRV_se0_ag2_f_03,644.2525,645.6046,1.3521,and God know he didn't. And so,didn't,1,0,9.110514239,9.08,5.5
PRV_se0_ag3_f_03_1,570,PRV_se0_ag2_f_03,657.4842,659.0062,1.522,"I said, I know they ain't gonna let her stay back there.",ain't,1,1,10.7425192,10.7,4.5
PRV_se0_ag3_f_03_1,599,PRV_se0_ag2_f_03,687.4418,689.6433,2.2015,I didn't know what to do. I thought y'all had just got,didn't,1,0,13.64622712,13.62,8.25
PRV_se0_ag3_f_03_1,603,PRV_se0_ag2_f_03,691.6042,692.8188,1.2146,I said we ain't got grounded.,ain't,1,1,12.2351907,12.18,5
PRV_se0_ag3_f_03_1,653,PRV_se0_ag3_f_03,753.3002,754.1496,0.8494,I ain't heard nothing about it.,ain't,1,1,7.257887021,6.98,3.75
PRV_se0_ag3_f_03_1,668,PRV_se0_ag3_f_03,768.5979,770.1694,1.5715,I didn't hear nothing about Princeville.,didn't,1,0,5.215062002,5.15,7.25
PRV_se0_ag3_f_03_1,786,PRV_se0_ag3_f_03,919.4757,924.846,5.3703,"And all that food in the frigerator. I told the man. Man said, it ain't no good. He took the whole thing and throw it in the trash pile.",ain't,1,1,12.42999312,12.26,18.75
PRV_se0_ag3_f_03_1,788,PRV_se0_ag3_f_03,925.6456,926.8789,1.2333,I didn't say nothing.,didn't,1,0,12.97062857,12.88,13.5
PRV_se0_ag3_f_03_1,970,PRV_se0_ag3_f_03,1143.7805,1146.6474,2.8669,but I don't think some people ain't got no heart in them.,ain't,1,1,14.27818369,14.11,16.5
PRV_se0_ag3_f_03_1,982,PRV_se0_ag2_f_03,1166.2097,1167.8661,1.6564,Some of the people didn't come back.,didn't,1,0,14.15679757,14.05,4
PRV_se0_ag3_f_03_1,983,PRV_se0_ag2_f_03,1168.1153,1168.7448,0.6295,Sure didn't.,didn't,1,0,6.150631701,6.04,8.25
PRV_se0_ag3_f_03_1,985,PRV_se0_ag2_f_03,1169.2134,1170.4528,1.2394,No they didn't not come back.,didn't,1,0,3.787773122,3.64,4.25
