File,Line,Speaker,UttStartTime,UttEndTime,UttLength,Content,AintVariation,InstancesCountPerLine,FeatureCountPerLine,WadaSNRMeade,WadaSNRRigal,NistSNRRigal
DCA_se3_ag3_m_01_2,744,DCA_se3_ag3_m_01,1136.6986,1140.2284,3.5298,"we f- got down there, and we stayed around a little while. We didn't",didn't,1,0,7.959954915,7.8,3.5
DCA_se3_ag3_m_01_2,784,DCA_se3_ag3_m_01,1196.3535,1201.9945,5.641,"I didn't know whether I was going to make it or not, but I wasn't that seriously ill, but it just seemed as though- ",didn't,1,0,13.18757104,13.12,12.25
DCA_se3_ag3_m_01_2,790,DCA_se3_ag3_m_01,1206.577,1207.9945,1.4175,And I didn't know just,didn't,1,0,9.061990135,8.79,18
DCA_se3_ag3_m_01_2,792,DCA_se3_ag3_m_01,1208.568,1211.3098,2.7418,"what it was all about. I didn't know whether I had a ruptured uh,",didn't,1,0,9.144640583,8.96,4
DCA_se3_ag3_m_01_2,832,DCA_se3_ag3_m_01,1267.9898,1276.946,8.9562,"uh, she had something- She had a- a rheumatic heart condition when she was young that we didn't know about until two months before she went in- three months before she went in the hospital.",didn't,1,0,7.364566345,7.29,6
DCA_se3_ag3_m_01_2,834,DCA_se3_ag3_m_01,1277.7889,1283.0487,5.2598,"And uh, of course, uh, she had two major operations, and the second operation, she didn't make it.",didn't,1,0,9.867638941,9.67,4
DCA_se3_ag3_m_02_1,215,DCA_se3_ag3_m_02,276.6357,278.8528,2.2171,if I'm not mistaken and,I'm not,1,0,28.72088815,28.4,33.75
DCA_se3_ag3_m_02_1,287,DCA_se3_ag3_m_02,361.1544,362.6711,1.5167,I didn't live in a neighborhood where I could have one.,didn't,1,0,10.71067341,10.65,4
DCA_se3_ag3_m_02_1,390,DCA_se3_ag3_m_02,489.5721,492.8355,3.2634,and he used to take us in the bathroom if we didn't like it and fight us you know and win.,didn't,1,0,12.26164289,12.23,4.75
DCA_se3_ag3_m_02_1,432,DCA_se3_ag3_m_02,536.4881,539.2121,2.724,"No I haven't had that problem, no ",haven't,1,0,12.63730445,12.56,4.75
DCA_se3_ag3_m_03_1,98,DCA_se3_ag3_m_03,107.3275,109.1359,1.8084,Let me tell her I'm not gonna- uh.,I'm not,1,0,11.41389249,11.33,10.5
DCA_se3_ag3_m_03_1,286,DCA_se3_ag3_m_03,369.379,373.5938,4.2148,"would have been alive some years ago with me, but I- I'm not even certain about that.",I'm not,1,0,15.15805693,15.07,9.25
DCA_se3_ag3_m_03_1,517,DCA_se3_ag3_m_03,716.9458,719.3172,2.3714,know what it is that I haven't done today.,haven't,1,0,11.79493133,11.76,6
DCA_se3_ag3_m_03_1,577,DCA_se3_ag3_m_03,787.9619,792.4174,4.4555,"I'm not making any plans for spending a lot of money. I'll wait until I get the money, and then I'll",I'm not,1,0,13.84781757,13.8,5.75
DCA_se3_ag3_m_03_1,661,DCA_se3_ag3_m_03,900.8133,903.7604,2.9471,"Ain't nobody there particularly cares about turkey, so",ain't,1,1,13.9059785,13.73,18
DCA_se3_ag3_m_03_1,703,DCA_se3_ag3_m_03,976.9707,978.9844,2.0137,maybe I didn't think I might die.,didn't,1,0,16.41064054,16.36,26.25
DCA_se3_ag3_m_03_1,735,DCA_se3_ag3_m_03,1021.5855,1023.2424,1.6569,I didn't think I might die,didn't,1,0,15.21356527,15.18,20.5
DCA_se3_ag3_m_04_1,74,DCA_se3_ag3_m_04,100.3843,101.5955,1.2112,"No, uh, we didn't.",didn't,1,0,11.92549004,11.82,3.25
DCA_se3_ag3_m_04_1,550,DCA_se3_ag3_m_04,795.4668,797.5826,2.1158,Uh- uh- I didn't take French. I took Latin.,didn't,1,0,13.91474218,13.8,22.25
DCA_se3_ag3_m_04_1,597,DCA_se3_ag3_m_04,852.6023,855.4094,2.8071,"and at that age, you know, I didn't want to hear it.",didn't,1,0,13.86555643,13.78,24.75
DCA_se3_ag3_m_04_1,672,DCA_se3_ag3_m_04,964.0389,966.3937,2.3548,We didn't ever play any tricks on the teacher because,didn't,1,0,15.47794459,15.37,18.5
DCA_se3_ag3_m_04_1,791,DCA_se3_ag3_m_04,1145.5217,1147.838,2.3163,"See, you didn't have new people to move in.",didn't,1,0,12.46435585,12.33,7.25
DCA_se3_ag3_m_04_1,857,DCA_se3_ag3_m_04,1240.6637,1241.32,0.6563,you didn't work.,didn't,1,0,11.41220479,11.33,2.5
DCA_se3_ag4_m_01_1,134,DCA_se3_ag4_m_01,156.5506,157.9209,1.3703,"No, we didn't call it home.",didn't,1,0,16.27598092,16.06,13
DCA_se3_ag4_m_01_1,175,DCA_se3_ag4_m_01,220.1522,222.5681,2.4159,"but, uh, no, we didn't uh play that one. No.",didn't,1,0,21.49680364,21.26,3.25
DCA_se3_ag4_m_01_1,180,DCA_se3_ag4_m_01,228.6653,232.0771,3.4118,you stand a certain place- it's almost like the same even when you didn't hide.,didn't,1,0,22.35700158,22.18,27
DCA_se3_ag4_m_01_1,243,DCA_se3_ag4_m_01,300.4476,302.7418,2.2942,Meet the Press to me isn't worth seeing.,isn't,1,0,25.73484813,25.46,27.5
DCA_se3_ag4_m_01_1,354,DCA_se3_ag4_m_01,464.1799,467.469,3.2891,observed the one this morning. But I didn't get a chance to do the one this morning because I was,didn't,1,0,16.99569976,16.89,29
DCA_se3_ag4_m_01_1,370,DCA_se3_ag4_m_01,483.6331,484.8325,1.1994,and I haven't seen,haven't,1,0,18.8461098,18.73,28.25
DCA_se3_ag4_m_01_1,576,DCA_se3_ag4_m_01,765.6425,767.4098,1.7673,didn't approve of the engagement.,didn't,1,0,25.25576023,25.06,25.5
DCA_se3_ag4_m_01_1,775,DCA_se3_ag4_m_01,1007.9104,1009.244,1.3336,he just didn't uh,didn't,1,0,18.79849835,18.67,28.5
DCA_se3_ag4_m_01_1,850,DCA_se3_ag4_m_01,1102.6848,1105.0584,2.3736,"I don't- we haven't used it yet, but I can use it for that purpose.",haven't,1,0,24.76534316,24.6,34
DCA_se3_ag4_m_01_1,992,DCA_se3_ag4_m_01,1286.9036,1289.274,2.3704,"Racing of trains. He had the right of way, and I didn't have a right of the way.",didn't,1,0,12.18893821,12.12,5
DCA_se3_ag4_m_01_1,1170,DCA_se3_ag4_m_01,1510.0434,1511.4842,1.4408,we didn't- they didn't close school for us.,didn't,2,0,19.86336438,19.77,30
DCA_se3_ag4_m_01_1,1174,DCA_se3_ag4_m_01,1513.4508,1518.2629,4.8121,"No, they didn't close school when we were going- it was cold days of going to school, get to school you're so cold you couldn't sit in a chair so well.",didn't,1,0,19.26505394,19.12,26.5
DCA_se3_ag4_m_01_1,1389,DCA_se3_ag4_m_01,1803.3502,1806.6702,3.32,"No, no indeed, you didn't think that  you would've-",didn't,1,0,13.17136119,13.1,7
DCA_se3_ag4_m_01_1,1404,DCA_se3_ag4_m_01,1828.3119,1834.4471,6.1352,"Oh yes, definitely so, definitely so. People- they- maybe- are they aren't changing fast enough for the number of people that we have on our hands. I mean",aren't,1,0,17.88155709,17.8,12
DCA_se3_ag4_m_01_1,1606,DCA_se3_ag4_m_01,2106.9695,2112.3258,5.3563,So it hasn't- what have to be done about it? Nothing. And the Look magazine has a ver- very good article in there I think on that.,hasn't,1,0,15.38187414,15.25,8.5
DCA_se3_ag4_m_01_1,1637,DCA_se3_ag4_m_01,2165.3894,2166.9748,1.5854,"that I didn't think much of him as a teacher,",didn't,1,0,20.44690673,20.2,22.75
DCA_se3_ag4_m_01_1,1643,DCA_se3_ag4_m_01,2171.879,2174.4588,2.5798,I didn't think much of him as a teacher. His- his uh,didn't,1,0,16.0374773,15.9,21
DCA_se3_ag4_m_01_1,1653,DCA_se3_ag4_m_01,2183.9024,2185.0354,1.133,I didn't th- think much of him.,didn't,1,0,20.43961329,20.06,5.75
DCA_se3_ag4_m_01_1,1657,DCA_se3_ag4_m_01,2189.1749,2191.0401,1.8652,But I didn't think much of him as teacher.,didn't,1,0,19.62852769,19.26,4.5
DCA_se3_ag4_m_01_1,1735,DCA_se3_ag4_m_01,2299.7902,2301.9538,2.1636,"No, at that time Howard didn't have too many white",didn't,1,0,13.6714672,13.59,6.25
DCA_se3_ag4_m_01_1,1753,DCA_se3_ag4_m_01,2315.5583,2318.6871,3.1288,I'd never- you don't come- didn't come across many of them,didn't,1,0,22.13136018,21.79,23.75
DCA_se3_ag4_m_01_2,147,DCA_se3_ag4_m_01,199.2111,202.7607,3.5496,"Maybe I shoulda just chest- checked it myself, but I didn't do it. Now, the fourth month comes up-",didn't,1,0,24.68113802,24.44,24.75
DCA_se3_ag4_m_01_2,149,DCA_se3_ag4_m_01,203.2118,204.4349,1.2231,he didn't know anything hardly.,didn't,1,0,26.29072284,26.12,18
DCA_se3_ag4_m_01_2,226,DCA_se3_ag4_m_01,299.1259,301.691,2.5651,I'm not worried about it. I was- I was Acting Battalion Chief for-,I'm not,1,0,17.68233779,17.49,8
DCA_se3_ag4_m_01_2,408,DCA_se3_ag4_m_01,514.7033,516.6385,1.9352,"Well heck if you didn't have white liberals, where would the Negro begin.",didn't,1,0,9.073673659,9,5
DCA_se3_ag4_m_01_2,493,DCA_se3_ag4_m_01,624.0999,625.6237,1.5238,We haven't been going to the Midnight Mass,haven't,1,0,13.45644191,13.37,6
DCA_se3_ag4_m_01_2,515,DCA_se3_ag4_m_01,663.3451,665.0459,1.7008,"uh, but it didn't last very long.",didn't,1,0,14.24692451,14.1,3.25
DCA_se3_ag4_m_02_1,24,DCA_se3_ag4_m_02,24.6343,26.7559,2.1216,Red Rover? That's just like Hide and Seek isn't it?,isn't,1,0,14.09719829,13.96,13
DCA_se3_ag4_m_02_1,125,DCA_se3_ag4_m_02,129.4554,133.3625,3.9071,"I'm- I'm not- not- It been quite s- Been so long, you know, since I've played it.",I'm not,1,0,19.28359243,19.24,18.25
DCA_se3_ag4_m_02_1,315,DCA_se3_ag4_m_02,363.7905,366.0101,2.2196,"Uh, you know I didn't have time to finish the game.",didn't,1,0,9.821091557,9.57,7.5
DCA_se3_ag4_m_02_1,325,DCA_se3_ag4_m_02,373.114,376.3314,3.2174,"I'm not interested in baseball. I used to play it, see?",I'm not,1,0,14.58436907,14.54,10
DCA_se3_ag4_m_02_1,346,DCA_se3_ag4_m_02,399.2217,401.6231,2.4014,"but I'm not too familiar with the players, you know.",I'm not,1,0,16.33957699,16.23,18.25
DCA_se3_ag4_m_02_1,420,DCA_se3_ag4_m_02,484.891,486.9534,2.0624,"I didn't have to depend on, you know,",didn't,1,0,11.52766719,11.45,19.25
DCA_se3_ag4_m_02_1,684,DCA_se3_ag4_m_02,772.5972,774.7783,2.1811,"I didn't want- didn't go home that evening,",didn't,2,0,10.209849,10.15,6.75
DCA_se3_ag4_m_02_1,928,DCA_se3_ag4_m_02,1043.8551,1048.2102,4.3551,"as long as they didn't bother me cause I- I did most of the deviling. You know, I was in the-",didn't,1,0,11.26195151,11.21,7.5
DCA_se3_ag4_m_02_1,1116,DCA_se3_ag4_m_02,1253.3594,1255.165,1.8056,"See, which I didn't tell 'em, see?",didn't,1,0,14.62988037,14.49,6.75
DCA_se3_ag4_m_02_1,1142,DCA_se3_ag4_m_02,1277.6101,1278.7368,1.1267,I didn't know. He'd,didn't,1,0,11.45068332,11.34,4.75
DCA_se3_ag4_m_02_1,1205,DCA_se3_ag4_m_02,1338.5553,1341.883,3.3277,"I haven't fooled with it since. Course I play my own numbers now, see?",haven't,1,0,14.92652957,14.77,8
DCA_se3_ag4_m_02_1,1220,DCA_se3_ag4_m_02,1353.8831,1355.7913,1.9082,"to uh, make a profit off it, I'm not.",I'm not,1,0,13.03070704,12.9,9.75
DCA_se3_ag4_m_02_1,1226,DCA_se3_ag4_m_02,1362.2718,1364.0735,1.8017,"and make a profit off it, but I'm not, see?",I'm not,1,0,12.74392681,12.53,18.5
DCA_se3_ag4_m_02_1,1373,DCA_se3_ag4_m_02,1528.826,1530.3227,1.4967,"they didn't have- u- I mean,",didn't,1,0,14.08974011,14.04,11.5
DCA_se3_ag4_m_02_1,1517,DCA_se3_ag4_m_02,1684.9652,1686.6592,1.694,I didn't have any bills. No debts.,didn't,1,0,13.03218511,12.97,13.25
DCA_se3_ag4_m_02_1,1625,DCA_se3_ag4_m_02,1787.7473,1789.8226,2.0753,"and we just didn't manage, you know.",didn't,1,0,16.79660194,16.68,15.25
DCB_se1_ag1_f_01_1,47,DCB_int_01,65.1988,65.4693,0.2705,You didn't-,didn't,1,0,27.81651429,25.2,29.25
DCB_se1_ag1_f_01_1,80,DCB_se1_ag1_f_01,107.7864,108.3413,0.5549,I'm not sure.,I'm not,1,0,10.24498992,9.29,2.75
DCB_se1_ag1_f_01_1,285,DCB_se1_ag1_f_01,361.6953,362.5758,0.8805,cause I didn't know,didn't,1,0,18.51175686,18.05,7.25
DCB_se1_ag1_f_01_1,289,DCB_se1_ag1_f_01,364.6292,368.3506,3.7214,"So I ain't know nothing about it, so my mother's like, you know, go to SYP, sign up for them",ain't,1,1,24.66717445,23.51,26.25
DCB_se1_ag1_f_01_1,321,DCB_int_01,405.8085,408.0979,2.2894,didn't do well or what- They're gonna place you where they want you to be.,didn't,1,0,12.55122305,11.42,7.5
DCB_se1_ag1_f_01_1,334,DCB_se1_ag1_f_01,424.2453,426.4139,2.1686,"Oh, no. No they didn't give me no feedback, no.",didn't,1,0,26.9981151,26.34,22.75
DCB_se1_ag1_f_01_1,394,DCB_se1_ag1_f_01,493.721,494.5464,0.8254,I ain't go that long.,ain't,1,1,13.87144502,13.43,4.75
DCB_se1_ag1_f_01_1,469,DCB_int_01,571.6837,572.5918,0.9081,I'm not from DC.,I'm not,1,0,22.30113272,21.14,29.25
DCB_se1_ag1_f_01_1,545,DCB_se1_ag1_f_01,669.6468,671.6099,1.9631,"No, I didn't get no scholarship for that.",didn't,1,0,35.22752804,33.49,36
DCB_se1_ag1_f_01_1,567,DCB_se1_ag1_f_01,700.2996,702.1928,1.8932,I didn't like Math. That's the only thing.,didn't,1,0,41.44618123,39.59,40.25
DCB_se1_ag1_f_01_1,570,DCB_int_01,704.7609,705.5489,0.788,Why you didn't like Math?,didn't,1,0,22.73239191,20.66,30
DCB_se1_ag1_f_01_1,576,DCB_se1_ag1_f_01,709.7117,711.1759,1.4642,"you know, you d- like I didn't know.",didn't,1,0,16.96003697,16.35,10.5
DCB_se1_ag1_f_01_1,690,DCB_int_01,845.2089,848.178,2.9691,"Now you know I'm not from DC, so you got to kind of explain stuff to me",I'm not,1,0,23.74487581,23.28,31.5
DCB_se1_ag1_f_01_1,817,DCB_int_01,995.3756,998.7562,3.3806,But isn't a lot of go go- Don't they do a lot of covers of R and B songs?,isn't,1,0,19.94965917,19.01,9.25
DCB_se1_ag1_f_01_1,928,DCB_se1_ag1_f_01,1121.6798,1125.2594,3.5796,And then we started playing with each other cause I ain't- We- We ain't had no friends when we was little either.,ain't,2,2,19.73335731,18.34,29.75
DCB_se1_ag1_f_01_1,971,DCB_se1_ag1_f_01,1176.6766,1180.2241,3.5475,"Cause I like walking, so I be walking around Kenilworth. Like, ain't nobody gonna do nothing to me.",ain't,1,1,20.57280466,20.25,16.25
DCB_se1_ag1_f_01_1,1063,DCB_se1_ag1_f_01,1287.423,1288.197,0.774,I ain't doing that.,ain't,1,1,17.37856683,16.01,16
DCB_se1_ag1_f_01_1,1108,DCB_int_01,1343.2136,1346.1053,2.8917,I'm not mad. We all have little side hustles. I'm not mad.,I'm not,2,0,14.0560037,13.75,9.75
DCB_se1_ag1_f_01_1,1140,DCB_int_01,1386.2162,1389.1072,2.891,sports and br- Well I'm not surprised about the broadcasting part.,I'm not,1,0,38.20621712,33.35,19.75
DCB_se1_ag1_f_01_1,1142,DCB_int_01,1389.6667,1390.5014,0.8347,I'm not surprised.,I'm not,1,0,80.45816303,56.67,25.75
DCB_se1_ag1_f_01_1,1196,DCB_se1_ag1_f_01,1453.3306,1455.7274,2.3968,"Cause when I've been, I didn't see it like that.",didn't,1,0,26.47734006,25.93,42.75
DCB_se1_ag1_f_01_1,1275,DCB_se1_ag1_f_01,1546.8728,1548.682,1.8092,"I don't know. I'm not sure. I think it's like,",I'm not,1,0,20.95435129,19.58,25.25
DCB_se1_ag1_f_01_1,1337,DCB_se1_ag1_f_01,1630.3657,1633.0224,2.6567,"Yeah, I mean- I'm not sure because I haven't like,",I'm not,1,0,20.38125459,19.8,5
DCB_se1_ag1_f_01_1,1337,DCB_se1_ag1_f_01,1630.3657,1633.0224,2.6567,"Yeah, I mean- I'm not sure because I haven't like,",haven't,1,0,20.38125459,19.8,5
DCB_se1_ag1_f_01_1,1341,DCB_se1_ag1_f_01,1634.5985,1638.6074,4.0089,"the stores that you just- Like, wherever that you just named? I haven't been like",haven't,1,0,27.14252011,26.18,38.75
DCB_se1_ag1_f_01_1,1347,DCB_se1_ag1_f_01,1640.9575,1641.6802,0.7227,"I'm not sure,",I'm not,1,0,14.99278603,14.33,2.75
DCB_se1_ag1_f_01_1,1408,DCB_se1_ag1_f_01,1706.2534,1707.517,1.2636,"I didn't have to pay for it,",didn't,1,0,27.55066446,26.78,26.25
DCB_se1_ag1_f_01_1,1414,DCB_se1_ag1_f_01,1711.941,1715.4941,3.5531,"She talking about some, it's a dollar. It's a dollar. I said, no. They didn't pay for it,",didn't,1,0,22.87541858,22.5,29.75
DCB_se1_ag1_f_01_1,1422,DCB_se1_ag1_f_01,1722.3836,1726.417,4.0334,"I look on the side, I see the dollar still sitting right there. So you didn't even put it in the-",didn't,1,0,22.76096758,22.48,18.25
DCB_se1_ag1_f_01_1,1432,DCB_se1_ag1_f_01,1735.6286,1739.3962,3.7676,"I knew she was- she was probably gonna pocket it, cause how come you ain't put it in the drawer yet?",ain't,1,1,23.9264462,23.4,32.5
DCB_se1_ag1_f_01_1,1442,DCB_se1_ag1_f_01,1752.7659,1754.799,2.0331,So why didn't you put the dollar in the drawer yet?,didn't,1,0,18.10664807,17.88,13
DCB_se1_ag1_f_01_1,1454,DCB_se1_ag1_f_01,1769.008,1772.2627,3.2547,"Cause I was, you know, in the store like, I didn't have to pay for this.",didn't,1,0,28.22596519,27.6,29.5
DCB_se1_ag1_f_01_1,1459,DCB_int_01,1778.1881,1783.212,5.0239,"I ain't want you to have like, Most Wanted: RD-NAME-2 on the sign. You can't walk in the store or something. Okay.",ain't,1,1,27.1715199,26.83,20.25
DCB_se1_ag1_f_01_1,1581,DCB_int_01,1940.398,1945.8804,5.4824,R- I knew you were gonna say red velvet. I knew- Why- That's everybody's favorite. I'm'a bring you something different. I'm not gonna bring you red velvet.,I'm not,1,0,19.21173415,17.89,12
DCB_se1_ag1_f_01_1,1612,DCB_se1_ag1_f_01,1989.1147,1989.87,0.7553,"Oh, I'm not sure.",I'm not,1,0,19.09800014,18.56,23.25
DCB_se1_ag1_f_02_1,271,DCB_se1_ag3_m_01,346.279,350.8701,4.5911,"when you're not from around, you know, they didn't see you and you like kind of new or whatever that's when they-",didn't,1,0,10.0403096,9.51,9.25
DCB_se1_ag1_f_02_1,1038,DCB_se1_ag3_m_01,1374.2289,1377.8317,3.6028,"Oh I didn't know that, see I really learned something today, I didn't know that.",didn't,2,0,12.50587789,11.82,11.75
DCB_se1_ag1_f_02_1,1182,DCB_se1_ag1_f_02,1553.1907,1556.4973,3.3066,"Uh, I'm chill, I'm not the type of person to start drama.",I'm not,1,0,16.15091235,15.94,7
DCB_se1_ag1_f_02_1,1400,DCB_se1_ag1_f_02,1833.8995,1835.5445,1.645,"Oh, I haven't experienced",haven't,1,0,16.65506415,16.53,19.5
DCB_se1_ag1_f_02_1,1408,DCB_se1_ag1_m_04,1843.3892,1846.9448,3.5556,"Me neither, I really didn't experience, uh, racism neither.",didn't,1,0,10.93704113,10.26,5.75
DCB_se1_ag1_f_02_1,1592,DCB_se1_ag3_m_01,2077.3487,2084.2686,6.9199,"Tell me about the Wizards, why- if I'm a fa- if I'm not a Wizards fan, I don't know nothing about basketball or nothing, tell me why I should be a Wizards fan.",I'm not,1,0,15.41339176,15.23,8.25
DCB_se1_ag1_f_03_1,125,DCB_int_01,182.0931,183.2464,1.1533,I didn't know you were a cheerleader.,didn't,1,0,10.5818534,10.26,6.25
DCB_se1_ag1_f_03_1,145,DCB_se1_ag1_f_03,214.2266,217.3574,3.1308,"No, I have a older brother who just didn't finish school.",didn't,1,0,18.33375194,17.83,27.5
DCB_se1_ag1_f_03_1,151,DCB_se1_ag1_f_03,224.4066,227.4261,3.0195,"he didn't graduate from high school he graduated from middle school, he didn't go to high school.",didn't,2,0,22.34687431,21.19,14.75
DCB_se1_ag1_f_03_1,212,DCB_int_01,306.852,312.401,5.549,"So- cause you just told me a whole lot of stuff that I didn't know. Cause I don't really- I've seen you, and we went on this college tour together.",didn't,1,0,17.61115967,17.44,10.5
DCB_se1_ag1_f_03_1,229,DCB_se1_ag1_f_03,333.1007,335.5775,2.4768,she didn't play about none of her grandkids.,didn't,1,0,33.43306001,31.29,34.25
DCB_se1_ag1_f_03_1,383,DCB_se1_ag1_f_03,529.7732,532.6783,2.9051,my paperwork haven't got switched over yet to her address.,haven't,1,0,24.65671515,23.91,29.25
DCB_se1_ag1_f_03_1,446,DCB_int_01,615.5645,617.3109,1.7464,describe the college trip cause I haven't heard it and,haven't,1,0,22.24021964,22.14,19.75
DCB_se1_ag1_f_03_1,451,DCB_se1_ag1_f_03,623.1663,628.3449,5.1786,"Um, it was like- it gave me a opportunity to know different colleges cause I didn't know it was a college named NYU,",didn't,1,0,17.62155094,17.42,24.5
DCB_se1_ag1_f_03_1,453,DCB_se1_ag1_f_03,628.716,632.5754,3.8594,"I didn't know it was a college named Medgar Evers, I didn't know it was a college,",didn't,2,0,22.78158221,22.18,34.25
DCB_se1_ag1_f_03_1,457,DCB_se1_ag1_f_03,634.7857,639.9451,5.1594,"Temple, I knew Temple but I didn't know like all the other colleges we went to, like Sarah Lawrence, I didn't know that was a college.",didn't,2,0,22.13983004,21.73,30.75
DCB_se1_ag1_f_03_1,465,DCB_se1_ag1_f_03,649.6581,652.3897,2.7316,before I went on the college tour I didn't really talk to nobody.,didn't,1,0,24.28587492,23.82,32.75
DCB_se1_ag1_f_03_1,644,DCB_se1_ag1_f_03,859.1591,861.0337,1.8746,he didn't really have a dad in his life.,didn't,1,0,15.64552817,15.21,3.25
DCB_se1_ag1_f_03_1,716,DCB_int_01,962.6465,964.1338,1.4873,I'm surprised you ain't tell them to shut up.,ain't,1,1,16.15412924,15.94,5
DCB_se1_ag1_f_03_1,722,DCB_int_01,969.5869,972.2923,2.7054,"Um, so I'm surprised you ain't got up and been like, look y'all, shut up.",ain't,1,1,25.88080644,25.59,22
DCB_se1_ag1_f_03_1,988,DCB_se1_ag1_f_03,1363.708,1364.459,0.751,You didn't hear about that?,didn't,1,0,17.29511324,16.82,21.75
DCB_se1_ag1_f_03_1,1133,DCB_int_01,1572.762,1573.9726,1.2106,So they ain't gonna think you a traitor?,ain't,1,1,15.19688902,15,24.5
DCB_se1_ag1_f_03_1,1135,DCB_int_01,1574.943,1575.7857,0.8427,"Oh, it ain't like that.",ain't,1,1,21.26698173,20.99,4.5
DCB_se1_ag1_f_03_1,1168,DCB_se1_ag1_f_03,1629.1107,1633.1423,4.0316,"you ain't g- letting them smell it, then they- you can't get in with it, they gon- they make you throw it in the trash.",ain't,1,1,16.69707759,16.22,7
DCB_se1_ag1_f_03_1,1169,DCB_int_01,1633.9682,1635.9682,2,Oh cause they think you got something that you ain't supposed to have.,ain't,1,1,13.55308306,13.29,8.25
DCB_se1_ag1_f_03_1,1262,DCB_se1_ag1_f_03,1747.9937,1750.4964,2.5027,And they came here with hickeys on they neck  I ain't see it.,ain't,1,1,13.97002852,13.66,8.5
DCB_se1_ag1_f_03_1,1270,DCB_int_01,1761.1693,1762.6626,1.4933,Yeah we ain't- we don't like RD-NAME-2. ,ain't,1,1,16.49319453,15.83,18.75
DCB_se1_ag1_f_03_1,1289,DCB_se1_ag1_f_03,1791.2418,1792.8126,1.5708,"Ain't my boo no more, I don't care.",ain't,1,1,12.45451568,12.11,5
DCB_se1_ag1_f_03_1,1323,DCB_se1_ag1_f_03,1835.1532,1836.4712,1.318,But RD-NAME-2 ain't like me.,ain't,1,1,7.882650495,7.74,2.5
DCB_se1_ag1_f_03_1,1370,DCB_se1_ag1_f_03,1890.6288,1893.0222,2.3934,"my bad, boo. I said, boo? I ain't your boo.",ain't,1,1,12.94161447,12.86,11.75
DCB_se1_ag1_f_03_1,1378,DCB_se1_ag1_f_03,1897.8419,1901.5863,3.7444,"I'm not finna go in the house change my- cause I got blood all over my shirt y'all, I'm'a have to go in the house change my clothes.",I'm not,1,0,13.36517777,13.14,5.75
DCB_se1_ag1_f_03_1,1435,DCB_int_01,1956.2738,1958.8451,2.5713,Oh that's why you and RD-NAME-2 ain't frie- Oh.,ain't,1,1,17.32041712,17.22,12.75
DCB_se1_ag1_f_03_1,1451,DCB_se1_ag1_f_03,1970.652,1972.5836,1.9316,Well I ain't say nothing that whole day to him. We here.,ain't,1,1,17.04508973,16.88,31.5
DCB_se1_ag1_f_03_1,1453,DCB_se1_ag1_f_03,1973.278,1977.8496,4.5716,"I ain't  that whole day, I'm just in the teen center I'm sitting on the couch, I'm just listening to my music on my phone.",ain't,1,1,23.52620393,22.86,27.5
DCB_se1_ag1_f_03_1,1543,DCB_se1_ag1_f_03,2085.2978,2090.6002,5.3024,"I gave RD-NAME-1 chance after cha- I ain't even give RD-NAME-1 three strikes, I gave him more than three strikes.",ain't,1,1,29.71010271,29.12,37
DCB_se1_ag1_f_03_1,1583,DCB_se1_ag1_f_03,2139.719,2141.879,2.16,after that we were just- ain't nothing really happen.,ain't,1,1,19.71928584,19.32,30
DCB_se1_ag1_f_03_1,1605,DCB_se1_ag1_f_03,2164.0475,2165.6386,1.5911,I'm not gonna talk to you for a long time.,I'm not,1,0,24.55851057,23.84,22.75
DCB_se1_ag1_f_03_1,1633,DCB_se1_ag1_f_03,2197.6749,2199.3229,1.648,"And I ain't s- I just kept saying, oh.",ain't,1,1,25.86445806,25.03,28.25
DCB_se1_ag1_f_03_1,1665,DCB_se1_ag1_f_03,2231.6503,2232.4189,0.7686,he ain't have nothing.,ain't,1,1,18.01277984,17.17,27.25
DCB_se1_ag1_f_03_1,1729,DCB_se1_ag1_f_03,2303.3555,2304.2016,0.8461,I ain't gonna see RD-NAME-1.,ain't,1,1,11.29543997,11.17,12.25
DCB_se1_ag1_f_03_1,1733,DCB_se1_ag1_f_03,2306.7392,2307.6512,0.912,I ain't gonna see him for a reason.,ain't,1,1,20.61106749,20.18,32
DCB_se1_ag1_f_03_1,1750,DCB_se1_ag1_f_03,2328.6581,2330.9268,2.2687,"So I said, no I'm not coming over there, I'm not coming over there,",I'm not,2,0,17.76835399,17.36,8
DCB_se1_ag1_f_03_1,1776,DCB_se1_ag1_f_03,2358.8008,2361.7267,2.9259,"And you took it for granted, so therefore we're done, I'm not talking to you. Like,",I'm not,1,0,17.77990922,17.17,4.75
DCB_se1_ag1_f_03_1,1888,DCB_se1_ag1_f_03,2506.9535,2509.4749,2.5214," I lost my cousin, I was still grieving, and you ain't care.",ain't,1,1,19.8172311,19.47,12
DCB_se1_ag1_f_03_1,1892,DCB_se1_ag1_f_03,2512.8989,2514.8466,1.9477,"He feel like everybody feel like I'm wrong, I'm not wrong.",I'm not,1,0,16.50028307,16.38,31.25
DCB_se1_ag1_f_03_1,1898,DCB_se1_ag1_f_03,2520.6405,2522.9664,2.3259,"I ain't stay here for that day, I left and went home.",ain't,1,1,19.38040977,18.93,4.5
DCB_se1_ag1_f_03_1,1904,DCB_se1_ag1_f_03,2534.1666,2539.432,5.2654,"And he ain't got no new girlfriend yet, I don't know why. He can go ahead- I- he can go ahead and get a new girlfriend. I'm not gonna hurt that girl.",I'm not,1,0,21.24367292,21.01,29.75
DCB_se1_ag1_f_03_1,1904,DCB_se1_ag1_f_03,2534.1666,2539.432,5.2654,"And he ain't got no new girlfriend yet, I don't know why. He can go ahead- I- he can go ahead and get a new girlfriend. I'm not gonna hurt that girl.",ain't,1,1,21.24367292,21.01,29.75
DCB_se1_ag1_f_03_1,1906,DCB_se1_ag1_f_03,2539.8526,2541.5617,1.7091,"He think I wanna hurt that girl, I'm not gonna hurt her.",I'm not,1,0,15.30884147,15.04,6.5
DCB_se1_ag1_f_03_1,2029,DCB_se1_ag1_f_03,2703.321,2705.185,1.864,I'm not gonna leave you alone until you my girl.,I'm not,1,0,16.09380922,15.72,4.25
DCB_se1_ag1_f_03_1,2031,DCB_se1_ag1_f_03,2706.2496,2707.3587,1.1091,"I ain't his girlfriend yet,",ain't,1,1,5.620470711,5.44,7.75
DCB_se1_ag1_f_03_1,2106,DCB_se1_ag1_f_03,2801.0158,2803.5609,2.5451,school when he lost his grandmother. He ain't never go back to school.,ain't,1,1,20.14964835,19.37,22
DCB_se1_ag1_f_03_1,2115,DCB_int_01,2813.2441,2814.5554,1.3113,"Mm-mm, I ain't gonna ask her.",ain't,1,1,13.0235129,12.9,4.75
DCB_se1_ag1_f_03_1,2130,DCB_int_01,2833.8619,2835.6204,1.7585,So for them six weeks he ain't gonna get no ride.,ain't,1,1,8.16081268,8.13,8.25
DCB_se1_ag1_f_03_1,2177,DCB_se1_ag1_f_03,2899.9429,2902.0093,2.0664,"Everybody think I'm not over him, I'm really over him.",I'm not,1,0,13.01398522,12.91,12
DCB_se1_ag1_m_01_1,405,DCB_int_01,409.4432,413.8533,4.4101,Thinking about- have you- so you haven't really lived anywhere else outside of Congress Heights,haven't,1,0,17.15997914,17.01,25.5
DCB_se1_ag1_m_01_1,766,DCB_se1_ag1_m_01,773.2502,774.8022,1.552,but I didn't know if he was gonna be gone,didn't,1,0,15.62216141,15.18,8
DCB_se1_ag1_m_01_1,776,DCB_se1_ag1_m_01,784.1384,785.2997,1.1613,I'm not used to dressing up.,I'm not,1,0,13.35188651,12.04,6.5
