File,Line,Speaker,UttStartTime,UttEndTime,UttLength,Content,AintVariation,InstancesCountPerLine,FeatureCountPerLine,WadaSNRMeade,WadaSNRRigal,NistSNRRigal
DCB_se2_ag3_m_02_1,1645,DCB_se2_ag3_m_02,1395.9586,1397.6221,1.6635,didn't know they were hormones at the time.,didn't,1,0,14.80381079,14.45,6.75
DCB_se2_ag3_m_02_1,1938,DCB_se2_ag3_m_02,1637.9858,1639.5665,1.5807,and he didn't stop and help.,didn't,1,0,21.29596728,20.33,6.5
DCB_se2_ag3_m_02_1,1986,DCB_se2_ag3_m_02,1672.3025,1673.4636,1.1611,I didn't ask anybody.,didn't,1,0,13.98042072,13.76,8
DCB_se2_ag3_m_02_1,2423,DCB_se2_ag3_m_02,2067.3851,2070.6713,3.2862,"The second day of school, I jumped out the window and said, I'm not going back.",I'm not,1,0,25.10950394,24.72,13.75
DCB_se2_ag3_m_02_1,2448,DCB_se2_ag3_m_02,2092.0927,2093.5988,1.5061,"they didn't really have beef anymore,",didn't,1,0,11.71159026,11.33,7
DCB_se2_ag3_m_02_1,2522,DCB_se2_ag3_m_02,2152.3771,2154.3635,1.9864,I didn't wanna be associated with that anymore,didn't,1,0,14.57045041,14.01,10.75
DCB_se2_ag3_m_02_1,2604,DCB_se2_ag3_m_02,2216.7229,2217.7943,1.0714,didn't cry,didn't,1,0,28.41813929,26,19
DCB_se2_ag3_m_02_1,2648,DCB_se2_ag3_m_02,2246.2846,2250.4521,4.1675,"I didn't know everything, but I knew enough to be like, I don't need to be here at RD-SCHOOL-2,",didn't,1,0,20.53867847,20.12,6.5
DCB_se2_ag3_m_02_1,2690,DCB_se2_ag3_m_02,2284.3864,2285.4076,1.0212,RD-SCHOOL-2 I didn't know,didn't,1,0,5.762750556,5.4,1.25
DCB_se2_ag3_m_02_1,2876,DCB_se2_ag3_m_02,2415.3151,2418.8345,3.5194,"I could hit RD-NAME-1 up right now, even though we haven't talked in a couple of months, and be like, yo,",haven't,1,0,17.70001709,17.33,8.25
DCB_se2_ag3_m_02_1,3014,DCB_se2_ag3_m_02,2531.9858,2534.238,2.2522,"people just didn't wanna go to class, they would call a bomb threat.",didn't,1,0,18.76654081,17.94,7
DCB_se2_ag3_m_02_1,3258,DCB_se2_ag3_m_02,2739.1193,2742.1209,3.0016,"and so, I didn't feel like anybody was being left behind,",didn't,1,0,21.34355568,21.01,10
DCB_se2_ag3_m_02_1,3308,DCB_se2_ag3_m_02,2778.9091,2780.3219,1.4128,"know and haven't seen me,",haven't,1,0,14.77009259,14.53,11.25
DCB_se2_ag3_m_02_1,3446,DCB_se2_ag3_m_02,2891.0439,2894.9934,3.9495,"it wasn't that I didn't do the work in her class. She just recognized that like,",didn't,1,0,23.41914649,22.64,11.25
DCB_se2_ag3_m_02_1,3540,DCB_se2_ag3_m_02,2964.3355,2965.0629,0.7274,I didn't-,didn't,1,0,50.56187259,44.81,40.25
DCB_se2_ag3_m_02_1,3558,DCB_se2_ag3_m_02,2980.988,2983.5339,2.5459,and I n- hadn't s- haven't shoplifted aga-,haven't,1,0,29.10118799,25.85,5.5
DCB_se2_ag3_m_02_1,3865,DCB_se2_ag3_m_02,3218.6064,3220.517,1.9106,"The time that I got caught, I didn't have them call my mom.",didn't,1,0,20.53943414,20.16,10
DCB_se2_ag3_m_02_1,3971,DCB_se2_ag3_m_02,3300.0287,3302.3555,2.3268,"uh, I lost my job then because we didn't have funding.",didn't,1,0,19.79111167,18.4,10
DCB_se2_ag3_m_02_1,4950,DCB_se2_ag3_m_02,4083.0786,4085.5686,2.49,"they didn't have any knitting kits, like, any, uh,",didn't,1,0,18.7997634,17.31,8.25
DCB_se2_ag3_m_02_1,5165,DCB_se2_ag3_m_02,4246.3422,4247.6105,1.2683,I didn't really mean that.,didn't,1,0,25.03314999,24.34,20.75
DCB_se2_ag3_m_02_1,5261,DCB_se2_ag3_m_02,4332.1701,4334.2217,2.0516,that you haven't heard from in years.,haven't,1,0,20.92849872,20.19,16
DCB_se2_ag3_m_02_1,5305,DCB_se2_ag3_m_02,4366.0298,4366.5381,0.5083,like he didn't,didn't,1,0,12.69110518,11.79,3
DCB_se2_ag3_m_02_1,5740,DCB_se2_ag3_m_02,4700.0958,4701.5542,1.4584,"like, he- I didn't recognize him,",didn't,1,0,19.74513825,19.47,11
DCB_se2_ag3_m_02_2,285,DCB_se2_ag3_m_02,237.4622,239.1082,1.646,and I'm not saying that it's our fault,I'm not,1,0,20.97727842,20.55,22.5
DCB_se2_ag3_m_02_2,384,DCB_se2_ag3_m_02,315.2477,316.5953,1.3476,didn't even know it was a thing.,didn't,1,0,19.0954641,18.62,31.5
DCB_se2_ag3_m_02_2,386,DCB_se2_ag3_m_02,316.6746,318.5584,1.8838,"Like a lot of us didn't know it was a thing,",didn't,1,0,29.98261393,29.59,22.25
DCB_se2_ag3_m_02_2,496,DCB_se2_ag3_m_02,395.4766,397.5982,2.1216,"the white people started coming, so I'm not gonna come anymore.",I'm not,1,0,20.7511335,20.06,15.25
DCB_se2_ag3_m_02_2,1263,DCB_se2_ag3_m_02,976.8403,978.3137,1.4734,you ain't- you ain't messing with that. That's not,ain't,2,2,15.35300491,14.42,10
DCB_se2_ag3_m_03_1,123,DCB_se2_ag3_m_03,132.925,133.6213,0.6963,"Ain't nothing, yo.",ain't,1,1,14.57692264,14.29,3.25
DCB_se2_ag3_m_03_1,282,DCB_se2_ag3_m_03,300.4119,301.4683,1.0564,but I ain't get knocked out.,ain't,1,1,10.19431472,9.88,2
DCB_se2_ag3_m_03_1,408,DCB_se2_ag3_m_03,451.1362,455.8276,4.6914,really didn't get along cause anybody that's from DC that stayed in DC and,didn't,1,0,12.12522484,12.02,7.75
DCB_se2_ag3_m_03_1,412,DCB_se2_ag3_m_03,459.2772,461.9953,2.7181,really didn't consider Maryland being,didn't,1,0,19.36298137,19.14,10.75
DCB_se2_ag3_m_03_1,502,DCB_se2_ag3_m_03,556.0534,557.1121,1.0587,Ain't too much happening.,ain't,1,1,23.17538639,22,20
DCB_se2_ag3_m_03_1,629,DCB_se2_ag3_m_03,719.4566,722.7073,3.2507,was- was born in because I didn't know too much about it. We,didn't,1,0,27.9118565,27.44,13
DCB_se2_ag3_m_03_1,639,DCB_se2_ag3_m_03,734.9994,738.9073,3.9079,Southview really didn't change too much other than up the street,didn't,1,0,21.48729729,21.17,12.5
DCB_se2_ag3_m_03_1,775,DCB_se2_ag3_m_03,896.7534,898.4942,1.7408,and ain't nobody about to change that.,ain't,1,1,15.81104222,15.54,9.75
DCB_se2_ag3_m_03_1,777,DCB_se2_ag3_m_03,898.6022,900.8473,2.2451,"You know what I'm saying, I'm from DC ain't nobody gonna chump me.",ain't,1,1,16.42390659,16.14,29
DCB_se2_ag3_m_03_1,935,DCB_se2_ag3_m_03,1076.5736,1077.9575,1.3839,"You know, he didn't know how to read.",didn't,1,0,19.52399708,18.9,23.25
DCB_se2_ag3_m_03_1,1147,DCB_se2_ag3_m_03,1341.701,1345.0969,3.3959," He sent me a request on Facebook, I ain't even accept that jont.",ain't,1,1,28.24307026,27.64,25.75
DCB_se2_ag3_m_03_1,1173,DCB_se2_ag3_m_03,1366.7458,1368.3898,1.644,you ain't really thinking about too much.,ain't,1,1,25.29135578,24.09,5
DCB_se2_ag3_m_03_1,1407,DCB_se2_ag3_m_03,1628.7409,1631.6594,2.9185,Cause I guess he just didn't think that I was mature enough for it but,didn't,1,0,18.9096127,18.33,6.25
DCB_se2_ag3_m_03_1,1465,DCB_se2_ag3_m_03,1698.6038,1703.1319,4.5281,all like that so I didn't carry that on but I- I- I try to do it at least with the kids.,didn't,1,0,19.56779145,19.04,7.5
DCB_se2_ag3_m_03_1,1501,DCB_se2_ag3_m_03,1746.1732,1748.3805,2.2073,I haven't tooken my sons- taken my sons,haven't,1,0,20.85366121,20.27,9.75
DCB_se2_ag3_m_03_1,1683,DCB_se2_ag3_m_03,1939.4174,1940.9707,1.5533,"Like, damn yo. You ain't even",ain't,1,1,15.05260801,14.56,4.25
DCB_se2_ag3_m_03_1,1711,DCB_se2_ag3_m_03,1972.461,1973.9037,1.4427,cause I didn't want for much.,didn't,1,0,27.17778079,26.37,16
DCB_se2_ag3_m_03_1,1743,DCB_se2_ag3_m_03,2002.1707,2005.1641,2.9934,My brother made sure I ain't get picked on or nothing like that.,ain't,1,1,19.47202804,19.05,6.25
DCB_se2_ag3_m_03_1,1823,DCB_se2_ag3_m_03,2089.9506,2092.9972,3.0466,"you know cause she didn't have to worry about my older siblings, they were all grown.",didn't,1,0,16.84561493,16.36,4.25
DCB_se2_ag3_m_03_1,1871,DCB_se2_ag3_m_03,2145.9399,2152.3034,6.3635,"and uh, he ain't really trip off of me being in the house as long as I checked in with him and let him know that I was still alive.",ain't,1,1,21.25709726,20.5,31
DCB_se2_ag3_m_03_1,1912,DCB_se2_ag3_m_03,2200.0957,2202.8058,2.7101,"West Virginia and all that other stuff you know what I'm saying, they didn't",didn't,1,0,18.93860423,18.24,6.25
DCB_se2_ag3_m_03_1,1974,DCB_se2_ag3_m_03,2269.3904,2270.9851,1.5947,he didn't look like the rest of 'em.,didn't,1,0,20.59685283,20.05,24.75
DCB_se2_ag3_m_03_1,2506,DCB_se2_ag3_m_03,2876.7141,2879.5666,2.8525,I didn't start going to see Chuck until I got older.,didn't,1,0,24.16405177,23.49,7.75
DCB_se2_ag3_m_03_1,2618,DCB_se2_ag3_m_03,3015.6739,3017.164,1.4901,"You know, it ain't too many people",ain't,1,1,17.06314811,16.24,4.75
DCB_se2_ag4_f_01_1,101,DCB_int_01,126.2746,126.5591,0.2845,You didn't-,didn't,1,0,5.946523744,5.75,2.75
DCB_se2_ag4_f_01_1,122,DCB_se2_ag4_f_01,144.7223,146.4615,1.7392,"uh, what I recall most- I didn't",didn't,1,0,19.10883815,18.75,17
DCB_se2_ag4_f_01_1,205,DCB_se2_ag4_f_01,251.6718,253.3866,1.7148,a lot- Cause they didn't treat her right.,didn't,1,0,20.26147954,19.84,11
DCB_se2_ag4_f_01_1,207,DCB_se2_ag4_f_01,253.5079,255.2285,1.7206,"They didn't treat her well. Um,",didn't,1,0,15.32766285,14.74,7.25
DCB_se2_ag4_f_01_1,213,DCB_se2_ag4_f_01,259.8856,263.49,3.6044,"didn't wanna waste, what they called not wanting to waste, and would bring home.",didn't,1,0,18.13714451,17.47,13
DCB_se2_ag4_f_01_1,340,DCB_int_01,415.7833,416.9767,1.1934,I'm not sure what that is,I'm not,1,0,7.311589733,6.19,4.75
DCB_se2_ag4_f_01_1,350,DCB_se2_ag4_f_01,430.5705,436.287,5.7165," I didn't really start to really feel that until I was um,",didn't,1,0,20.11047049,19.98,20
DCB_se2_ag4_f_01_1,356,DCB_se2_ag4_f_01,441.0093,443.3501,2.3408,We didn't have- You know it was always a sprinkle,didn't,1,0,16.43649154,16.3,4.75
DCB_se2_ag4_f_01_1,358,DCB_se2_ag4_f_01,444.053,447.5222,3.4692,"of- of- of white people living in- somewhere, but they didn't",didn't,1,0,17.27032804,17,19.75
DCB_se2_ag4_f_01_1,362,DCB_se2_ag4_f_01,448.7299,451.7177,2.9878,"intermingle with us. They didn't engage with us. Um,",didn't,1,0,11.47953594,11.1,5.25
DCB_se2_ag4_f_01_1,364,DCB_se2_ag4_f_01,452.2166,457.2607,5.0441,"they weren't rude or anything. Um, it's just like, they said, you know, you didn't bother them. They didn't bother us.",didn't,2,0,15.47389773,15.28,11.25
DCB_se2_ag4_f_01_1,370,DCB_se2_ag4_f_01,462.3142,466.7253,4.4111,I didn't have white teachers in elementary school. I had white teachers in high school. I went to c- c-,didn't,1,0,16.63240341,16.4,11.5
DCB_se2_ag4_f_01_1,499,DCB_se2_ag4_f_01,618.2162,622.1284,3.9122,"Um, as children, you know, you had a place. You didn't inter- You know, you didn't intervene.",didn't,2,0,16.69676948,15.51,9.25
DCB_se2_ag4_f_01_1,547,DCB_se2_ag4_f_01,673.6617,675.3171,1.6554,"Um, I'm not sure how much you wanna know.",I'm not,1,0,18.85850533,18.26,21.25
DCB_se2_ag4_f_01_1,612,DCB_se2_ag4_f_01,749.1822,752.0197,2.8375,"but she didn't believe in the- giving a child up, and",didn't,1,0,15.57741668,14.86,6
DCB_se2_ag4_f_01_1,643,DCB_se2_ag4_f_01,785.6639,789.3849,3.721,"he didn't treat my mother nicely, and he resented me cause I had a mouth.",didn't,1,0,15.5668246,14.68,10.25
DCB_se2_ag4_f_01_1,865,DCB_se2_ag4_f_01,1035.3551,1037.7145,2.3594,"We didn't have checking accounts, we used money orders.",didn't,1,0,24.95896846,23.72,14.75
DCB_se2_ag4_f_01_1,918,DCB_se2_ag4_f_01,1102.7485,1104.4551,1.7066,"Somehow didn't- You know, I missed that-",didn't,1,0,20.76480542,20.47,27
DCB_se2_ag4_f_01_1,928,DCB_se2_ag4_f_01,1112.3436,1115.005,2.6614,"tried to get into some activities, it just didn't work out,",didn't,1,0,24.88821868,24.45,18.25
DCB_se2_ag4_f_01_1,966,DCB_se2_ag4_f_01,1164.194,1168.0409,3.8469,"I wanted to do all these things. Didn't know how I was gonna do it, didn't know where the money was gonna come from.",didn't,2,0,17.70255392,17.42,8.5
DCB_se2_ag4_f_01_1,1034,DCB_se2_ag4_f_01,1257.155,1260.1287,2.9737,"we didn't have the tools to be married, you know, to stay married.",didn't,1,0,17.74813433,17.34,17.75
DCB_se2_ag4_f_01_1,1036,DCB_se2_ag4_f_01,1261.7654,1263.6212,1.8558,We didn't have a skill set to kn- know how to,didn't,1,0,20.7006338,20.47,30.5
DCB_se2_ag4_f_01_1,1040,DCB_se2_ag4_f_01,1267.2945,1268.5301,1.2356,So we didn't stay married long.,didn't,1,0,20.35806535,20.07,18.25
DCB_se2_ag4_f_01_1,1042,DCB_se2_ag4_f_01,1270.9164,1274.9172,4.0008,"We didn't l- get a legal divorce, but we separated. RD-NAME-3 musta been about",didn't,1,0,16.7153298,16.46,6
DCB_se2_ag4_f_01_1,1107,DCB_se2_ag4_f_01,1372.8464,1377.1177,4.2713,I didn't have any strategic plan or analyzed- All I knew is I wanted more.,didn't,1,0,19.72033342,19.29,7.75
DCB_se2_ag4_f_01_1,1111,DCB_se2_ag4_f_01,1383.4068,1385.4293,2.0225,I didn't- I really didn't focus on,didn't,2,0,22.5024722,22.29,14
DCB_se2_ag4_f_01_1,1135,DCB_se2_ag4_f_01,1420.3382,1423.6815,3.3433,There are people who I went to junior high school with and everything who didn't make it out.,didn't,1,0,17.0002592,16.73,9.25
DCB_se2_ag4_f_01_1,1203,DCB_se2_ag4_f_01,1511.2148,1512.651,1.4362,We didn't have a lot of love and affection.,didn't,1,0,28.11536612,27.88,32
DCB_se2_ag4_f_01_1,1215,DCB_se2_ag4_f_01,1534.1843,1535.863,1.6787,"I didn't think she was going to, but she did.",didn't,1,0,15.82529622,15.66,15
DCB_se2_ag4_f_01_1,1231,DCB_se2_ag4_f_01,1561.7561,1563.4441,1.688,Ain't just about the grades- I ain't had no plan!,ain't,2,2,19.43484666,19.34,10.75
DCB_se2_ag4_f_01_1,1233,DCB_se2_ag4_f_01,1564.3755,1564.991,0.6155,I ain't had no,ain't,1,1,13.09889919,12.89,5
DCB_se2_ag4_f_01_1,1245,DCB_se2_ag4_f_01,1575.5793,1576.4548,0.8755,I ain't know what saving no-,ain't,1,1,10.75546488,10.46,8
DCB_se2_ag4_f_01_1,1255,DCB_se2_ag4_f_01,1586.5534,1587.8637,1.3103,People didn't believe they were my children.,didn't,1,0,11.82842697,11.76,4.5
DCB_se2_ag4_f_01_1,1330,DCB_se2_ag4_f_01,1675.0914,1676.6068,1.5154,"Cause I didn't know anybody who had a lot of money,",didn't,1,0,15.0900092,14.92,4.25
DCB_se2_ag4_f_01_1,1392,DCB_se2_ag4_f_01,1749.185,1750.5781,1.3931,I didn't complain about anything.,didn't,1,0,22.54379538,22.31,20.5
DCB_se2_ag4_f_01_1,1426,DCB_se2_ag4_f_01,1794.4386,1795.511,1.0724,they didn't have anything.,didn't,1,0,19.07341641,18.55,24.75
DCB_se2_ag4_f_01_1,1590,DCB_se2_ag4_f_01,1994.3177,1999.7484,5.4307,"we had the attitude make our girls stronger cause we didn't- I didn't want her- I know for me, I didn't want her to rely on anybody",didn't,3,0,19.41248383,19.27,10.25
DCB_se2_ag4_f_01_1,1659,DCB_se2_ag4_f_01,2073.2398,2074.3962,1.1564,"I didn't care what they called me,",didn't,1,0,16.67118789,16.25,5.25
DCB_se2_ag4_f_01_1,1663,DCB_se2_ag4_f_01,2076.4292,2077.0168,0.5876,I didn't care.,didn't,1,0,21.92741176,21.07,18.5
DCB_se2_ag4_f_01_1,1730,DCB_se2_ag4_f_01,2161.1473,2167.0261,5.8788,"I didn't know when I come up- When I was coming up in DC, I knew nothing about the Southeast. That- just not to go there.",didn't,1,0,29.13869006,28.86,16.25
DCB_se2_ag4_f_01_1,1821,DCB_se2_ag4_f_01,2292.3313,2293.4924,1.1611,Didn't wanna go to a black school.,didn't,1,0,26.12375138,25.61,20.75
DCB_se2_ag4_f_01_1,1870,DCB_se2_ag4_f_01,2354.1965,2355.86,1.6635,"yourself from the folks who didn't have it,",didn't,1,0,20.03975725,19.73,23.5
DCB_se2_ag4_f_01_1,1876,DCB_se2_ag4_f_01,2359.1473,2360.5509,1.4036,or the same folks who didn't have it.,didn't,1,0,18.91289935,18.56,14.25
DCB_se2_ag4_f_01_1,1925,DCB_se2_ag4_f_01,2419.1147,2422.6713,3.5566,we got to help our people cause if we don't help 'em ain't nobody gonna help 'em. But,ain't,1,1,21.4013858,,
DCB_se2_ag4_f_01_1,1988,DCB_se2_ag4_f_01,2501.7345,2503.0541,1.3196,You didn't need a car in DC!,didn't,1,0,15.2802535,14.85,23.25
DCB_se2_ag4_f_01_1,1996,DCB_se2_ag4_f_01,2510.2478,2513.2728,3.025,We didn't even think about a car. We never even thought about driving- using a car,didn't,1,0,22.06586788,21.58,9.25
DCB_se2_ag4_f_01_1,2068,DCB_int_01,2604.0376,2606.0333,1.9957,That is not- I'm not surprised.,I'm not,1,0,13.54742679,12.98,7.5
DCB_se2_ag4_f_01_1,2130,DCB_se2_ag4_f_01,2691.0673,2695.5623,4.495,"the teachers were teachers. You know, w- you didn't have many black- uh, white teachers, but there were a few.",didn't,1,0,24.27905396,22.13,7.75
DCB_se2_ag4_f_01_1,2260,DCB_se2_ag4_f_01,2845.3267,2846.4085,1.0818,you didn't feel poor.,didn't,1,0,49.81591676,38.43,23
DCB_se2_ag4_f_01_1,2277,DCB_se2_ag4_f_01,2864.2546,2868.0817,3.8271,You didn't go out the house with your hair not combed. Your clothes had to be ironed.,didn't,1,0,23.26652938,21.41,9.5
DCB_se2_ag4_f_01_1,2346,DCB_se2_ag4_f_01,2953.4199,2956.7761,3.3562,"you know, but we didn't shop at no- no- none of those stores. We shopped at",didn't,1,0,23.92176658,21.35,9
DCB_se2_ag4_f_01_1,2364,DCB_se2_ag4_f_01,2975.6667,2976.576,0.9093,I haven't gotten there yet.,haven't,1,0,27.50455795,22.61,17.5
DCB_se2_ag4_f_01_1,2366,DCB_se2_ag4_f_01,2979.01,2979.9612,0.9512,I haven't gotten there yet.,haven't,1,0,25.24199366,22.52,11.75
DCB_se2_ag4_f_01_1,2498,DCB_int_01,3148.9837,3152.0613,3.0776,"or is that mental because, I still haven't reached a place I wanna be,",haven't,1,0,17.49951314,16.81,7.5
DCB_se2_ag4_f_01_1,2639,DCB_se2_ag4_f_01,3307.9596,3312.9338,4.9742,"were young when go go music was up, so I didn't get a chance to go out as much and do any of those things,",didn't,1,0,23.4933585,21.39,13.25
DCB_se2_ag4_f_01_1,2713,DCB_se2_ag4_f_01,3381.8108,3386.7057,4.8949,"No, they really didn't do the hat- well RD-NAME-3 did because she did a play",didn't,1,0,21.18985121,20.31,12
DCB_se2_ag4_f_01_1,2739,DCB_se2_ag4_f_01,3417.946,3420.4629,2.5169,"And they didn't want her to do it, and so I had to go up there.",didn't,1,0,47.56060883,31.76,9.75
DCB_se2_ag4_f_01_1,2783,DCB_se2_ag4_f_01,3461.7308,3463.1436,1.4128,"N- Unfortunately, I'm not.",I'm not,1,0,37.01789006,29.18,8.25
DCB_se2_ag4_f_01_1,2786,DCB_int_01,3464.1508,3466.3144,2.1636,"Alright, I didn't know if I had seen you wearing-",didn't,1,0,19.13509521,18.29,10.5
DCB_se2_ag4_f_01_1,2796,DCB_se2_ag4_f_01,3478.1885,3479.9639,1.7754,I'm not pledging anything.,I'm not,1,0,86.69798375,53.43,28.75
DCB_se2_ag4_f_01_1,2851,DCB_int_01,3544.1465,3547.8697,3.7232,"you know, I didn't do that as a student. So now like, hearing these stories and how much",didn't,1,0,20.72529387,18.19,3.5
DCB_se2_ag4_f_01_1,2899,DCB_se2_ag4_f_01,3609.4844,3613.3628,3.8784,"See when you w- We were- When I was coming up, that's all you had. You didn't have a whole bunch of a-",didn't,1,0,14.12136726,13.68,9.75
DCB_se2_ag4_f_01_1,2905,DCB_se2_ag4_f_01,3619.2695,3621.4051,2.1356,"If we didn't have real jacks, we played with",didn't,1,0,15.12284868,14.39,6.75
DCB_se2_ag4_f_01_1,2911,DCB_se2_ag4_f_01,3624.2017,3629.3857,5.184,"If we didn't have a baseball, we played- You know, we- we- If we had a bat and a ball, we was doing good.",didn't,1,0,18.95835674,18.26,11.75
DCB_se2_ag4_f_01_1,2924,DCB_se2_ag4_f_01,3648.8825,3652.4683,3.5858,"we- we didn't- we- You know, it was just a s- way it was. I mean, you-",didn't,1,0,22.091559,20.59,9
DCB_se2_ag4_f_01_1,2932,DCB_se2_ag4_f_01,3659.9546,3665.3449,5.3903,"you we- we were latchkey kids, for lack of a better word. We didn't look at it that way. Our parents worked. You went home. You",didn't,1,0,20.64877065,19.55,15.5
DCB_se2_ag4_f_01_1,2997,DCB_se2_ag4_f_01,3748.9113,3751.4794,2.5681,Obama ain't had nothing to do with the change of the feel of the city.,ain't,1,1,24.99238459,23.34,16.5
DCB_se2_ag4_f_01_1,3012,DCB_se2_ag4_f_01,3770.4259,3771.4145,0.9886,We didn't agree to that.,didn't,1,0,16.31346187,15.49,4
DCB_se2_ag4_f_01_1,3044,DCB_se2_ag4_f_01,3807.3678,3809.9779,2.6101,you didn't have this abundance of traffic and,didn't,1,0,32.56264575,28.47,25.75
DCB_se2_ag4_f_01_1,3048,DCB_se2_ag4_f_01,3814.1279,3816.1598,2.0319,All of those condos ain't filled up!,ain't,1,1,20.86465828,19.91,6
DCB_se2_ag4_f_01_1,3056,DCB_se2_ag4_f_01,3819.186,3822.1365,2.9505,"Okay. So we didn't fill our condos, so they get the tax breaks?",didn't,1,0,33.08990023,30.25,20.5
DCB_se2_ag4_f_01_1,3067,DCB_se2_ag4_f_01,3833.7028,3835.4048,1.702,a tax break cause I didn't make my-,didn't,1,0,43.13069689,35.48,26.25
DCB_se2_ag4_f_01_1,3071,DCB_se2_ag4_f_01,3841.9923,3845.247,3.2547,"In years to come, everything'll be contract. People ain't gonna have no place to work.",ain't,1,1,22.49372098,20.1,7.5
DCB_se2_ag4_f_01_1,3109,DCB_se2_ag4_f_01,3911.487,3913.1983,1.7113,Fenty didn't care. Williams didn't care.,didn't,2,0,25.9712483,25.04,27
DCB_se2_ag4_f_01_1,3115,DCB_se2_ag4_f_01,3918.1445,3919.52,1.3755,I didn't even know who she really was.,didn't,1,0,14.80913561,13.93,26.75
DCB_se2_ag4_f_01_1,3116,DCB_int_01,3920.4701,3922.4635,1.9934,"Yeah, she didn't- It wasn't a lot of people that voted.",didn't,1,0,16.99138743,15.5,13.25
DCB_se2_ag4_f_01_1,3221,DCB_se2_ag4_f_01,4068.5921,4072.0089,3.4168,"Eleanor Holmes Norton been fighting about it for twent- two decades, and we ain't got",ain't,1,1,26.53505144,24.18,13.5
DCB_se2_ag4_f_01_1,3260,DCB_se2_ag4_f_01,4119.0483,4121.3005,2.2522,W- w- They didn't give us our forty acres and a mule.,didn't,1,0,24.96908202,22.54,16.25
DCB_se2_ag4_f_01_1,3294,DCB_se2_ag4_f_01,4166.4515,4170.0885,3.637,"Every time- when I first thought I had, you know, I said, I'm not gonna be able to afford to live here.",I'm not,1,0,37.09547551,31.27,23.25
DCB_se2_ag4_f_01_1,3352,DCB_int_01,4236.1491,4236.69,0.5409,I didn't.,didn't,1,0,27.59983834,20.15,20
DCB_se2_ag4_f_01_1,3372,DCB_int_01,4255.8939,4257.3114,1.4175,I'm not surprised by that though.,I'm not,1,0,32.73489083,28.66,16.25
DCB_se2_ag4_f_01_1,3395,DCB_int_01,4285.3064,4287.1482,1.8418,It ain't much. Yeah. Mm-mm.,ain't,1,1,22.32270881,20.23,22
DCB_se2_ag4_f_01_1,3402,DCB_int_01,4294.673,4295.3678,0.6948,But didn't they just-,didn't,1,0,24.35117687,19.88,23
DCB_se2_ag4_f_01_1,3406,DCB_int_01,4296.8459,4297.7913,0.9454,Aren't they rebuilding?,aren't,1,0,14.63951897,14.21,14
DCB_se2_ag4_f_02_1,249,DCB_se2_ag4_f_02,267.8493,269.3419,1.4926,"Uh, my street didn't even have s-",didn't,1,0,15.58614462,14.79,6.5
DCB_se2_ag4_f_02_1,915,DCB_int_01,924.1569,926.9369,2.78,too nebulous for me right here so I'm not sure what to do.,I'm not,1,0,11.91884564,11.66,5.75
DCB_se2_ag4_f_02_1,917,DCB_int_01,927.2023,928.635,1.4327,"Like cause she ain't really white,",ain't,1,1,10.6536246,10.34,18.25
DCB_se2_ag4_f_02_1,1011,DCB_int_01,1034.2191,1038.5955,4.3764,"uh, she- I'm not really sure if she's white or black let me stay away from her, do you feel like you were embraced?",I'm not,1,0,16.98141186,16.31,10.75
DCB_se2_ag4_f_02_1,1110,DCB_int_01,1133.2218,1135.6378,2.416,Or maybe they just was being bitchy and they just didn't wanna-,didn't,1,0,12.59362575,12.18,4.75
DCB_se2_ag4_f_02_1,1112,DCB_int_01,1136.7423,1137.9396,1.1973,and they didn't wanna talk to you.,didn't,1,0,14.89688921,14.2,8.25
DCB_se2_ag4_f_02_1,1118,DCB_int_01,1140.4237,1146.9987,6.575,Okay so you were in high- so- But you didn't feel this at school this was kind of more outside of the walls of your s- because your school's a very diverse place.,didn't,1,0,23.10936698,22.84,6.75
DCB_se2_ag4_f_02_1,1133,DCB_int_01,1155.35,1156.3025,0.9525,But it didn't feel catty?,didn't,1,0,12.13588205,11.7,11.75
DCB_se2_ag4_f_02_1,1143,DCB_se2_ag4_f_02,1165.1901,1167.199,2.0089,I'm not gonna say it was catty it was just,I'm not,1,0,26.85776666,25.47,26
DCB_se2_ag4_f_02_1,1156,DCB_se2_ag4_f_02,1175.0983,1177.0272,1.9289,I'm not gonna say they were bullies but they were,I'm not,1,0,22.44724457,21.34,10
DCB_se2_ag4_f_02_1,1355,DCB_int_01,1390.2166,1391.2571,1.0405,I'm not surprised.,I'm not,1,0,11.5372284,11.52,12.25
DCB_se2_ag4_f_02_1,1356,DCB_int_01,1391.5252,1392.4386,0.9134,I'm not surprised.,I'm not,1,0,6.509618739,6.44,4.5
DCB_se2_ag4_f_02_1,1438,DCB_se2_ag4_f_02,1472.9475,1475.4326,2.4851,"And that was like taboo back then, you just didn't do that.",didn't,1,0,31.09507527,30.43,14
DCB_se2_ag4_f_02_1,1626,DCB_se2_ag4_f_02,1657.541,1658.4655,0.9245,freshman didn't do that.,didn't,1,0,18.12975144,17.84,16.75
DCB_se2_ag4_f_02_1,1707,DCB_se2_ag4_f_02,1731.2559,1734.4226,3.1667,"or the other thing me- I had to come back home if I didn't, I couldn't come back home.",didn't,1,0,27.11349081,26.82,39
DCB_se2_ag4_f_02_1,1824,DCB_se2_ag4_f_02,1856.4525,1861.3988,4.9463,they didn't have any problems putting up the funds for it or whatever I needed to do it because that meant that-,didn't,1,0,27.06039667,25.84,37.25
DCB_se2_ag4_f_02_1,1878,DCB_se2_ag4_f_02,1924.3571,1928.6629,4.3058,"um, because we decided late and w- and we didn't have enough time to do it but",didn't,1,0,21.6997746,20.77,14.5
DCB_se2_ag4_f_02_1,1880,DCB_se2_ag4_f_02,1929.019,1934.9856,5.9666,"you know I showed them how we could do it and how I moved these girls and got these girls on line, got all the paperwork we needed they didn't think",didn't,1,0,23.43780412,22.55,6.25
DCB_se2_ag4_f_02_1,1896,DCB_se2_ag4_f_02,1947.1666,1948.3792,1.2126,it's something they didn't think,didn't,1,0,26.52094596,24.82,30
DCB_se2_ag4_f_02_1,1950,DCB_se2_ag4_f_02,2003.9665,2005.039,1.0725,I didn't graduate on time.,didn't,1,0,18.49305776,18.33,25
DCB_se2_ag4_f_02_1,1952,DCB_se2_ag4_f_02,2005.8753,2007.7599,1.8846,"I didn't graduate on time, one of um,",didn't,1,0,21.02348508,20.38,41.5
DCB_se2_ag4_f_02_1,2062,DCB_se2_ag4_f_02,2112.7841,2114.4649,1.6808,got my grades and I didn't-,didn't,1,0,13.45242897,11.73,4.5
DCB_se2_ag4_f_02_1,2082,DCB_int_01,2132.0483,2133.791,1.7427,he didn't wanna push you out like- like,didn't,1,0,33.22767353,31.22,23
DCB_se2_ag4_f_02_1,2115,DCB_se2_ag4_f_02,2158.9475,2161.2409,2.2934,which didn't pay much money but it was what I wanted to do.,didn't,1,0,32.38447546,30.35,37.5
DCB_se2_ag4_f_02_1,2158,DCB_se2_ag4_f_02,2208.7045,2209.5729,0.8684,And I didn't wanna come back home.,didn't,1,0,35.29084379,34.02,23.5
DCB_se2_ag4_f_02_1,2247,DCB_se2_ag4_f_02,2286.4771,2287.2865,0.8094,"And that didn't happen,",didn't,1,0,26.85487281,23.05,22.75
DCB_se2_ag4_f_02_1,2277,DCB_se2_ag4_f_02,2312.6842,2313.6646,0.9804,I didn't wanna be at home.,didn't,1,0,17.93524222,17.7,29.5
DCB_se2_ag4_f_02_1,2358,DCB_se2_ag4_f_02,2393.4059,2395.9311,2.5252, We didn't- we were planning to get married but we didn't get ma-,didn't,2,0,17.49149364,16.59,7.75
DCB_se2_ag4_f_02_1,2404,DCB_se2_ag4_f_02,2434.7834,2437.2847,2.5013,I thought I was going back to Richmond so I didn't get a job,didn't,1,0,34.41908725,32.85,6
