File,Line,Content,InstancesCountPerLine,FeatureCountPerLine
283-130638-0046,46,in fact at first glance i thought it was a cod ah said the old gentleman following the direction of my gaze fine fellow that ain't he quite uncommon i murmured,1,1
288-131218-0020,20,you make me ashamed of being a horse you dare to say my master ain't your master that's your gratitude for the way he feeds you and spares you pray where would your carcass be if it weren't for him,1,1
288-131218-0022,22,you're a disgrace to the stable look at the horse next you he's something like a horse all skin and bone and his master ain't over kind to him either he put a stinging lash on his whip last week but that old horse knows he's got the wife and children to keep,1,1
288-131218-0026,26,you go along like a buttock of beef upon castors you do ain't you afraid i'll kick if you go on like that diamond,1,1
288-131218-0031,31,ankle indeed why should you ape your betters horses ain't got any ankles,1,1
288-131218-0037,37,because i wanted to grow fat you grease tub oh my teeth and tail i thought you were a humbug why did you want to get fat there's no truth to be got out of you but by cross questioning you ain't fit to be a horse because,1,1
288-131220-0004,4,during which they had been talking of her new prospects that nanny expressed to diamond her opinion of the country there ain't nothing in it but the sun and moon diamond there's trees and flowers said diamond,1,1
288-131220-0011,11,people's kind to lame boys you know sir but after dark there ain't so much doing diamond succeeded in bringing jim to mister raymond and the consequence was that he resolved to give the boy a chance he provided new clothes for both him and nanny,1,1
29-130626-0051,51,took up an independent position on the curb they ain't a going to starve are they said the gentleman from the boot shop ah you'd want to take a thing or two with you retorted the blue posts,1,1
2946-163375-0012,12,now i reckon the widow or the parson or somebody prayed that this bread would find me and here it has gone and done it so there ain't no doubt but there is something in that thingthat,1,1
2946-163375-0037,37,there warn't much sand in my craw but i says this ain't no time to be fooling around,1,1
2946-163375-0058,58,what all that time yesindeedy and ain't you had nothing but that kind of rubbage to eat no sahnuffn else well you must be most starved ain't you,2,2
2946-163375-0078,78,but i ain't no mo now,1,1
2946-163375-0090,90,and so you ain't had no meat nor bread to eat all this time why didn't you get mud turkles,1,1
3005-163391-0009,9,but then i says again no i reckon it ain't him or else he wouldn't be paddling up the river you ain't him are you,2,2
3005-163391-0017,17,old peter had friends and they ain't going to let them come to no harm,1,1
3005-163399-0025,25,why silas look yonder up the road ain't that somebody coming,1,1
3033-130750-0063,63,not of a spindle legged cuss like him shouted charlie because i ain't change of front,1,1
3045-163406-0027,27,but i ain't going to make no complaint any way that suits you suits me,1,1
3045-163406-0031,31,that ain't got nothing to do with it the thing for us to do is just to do our duty and not worry about whether anybody sees us do it or not hain't you got no principle at all all right i ain't saying nothing i'm the servant girl,2,2
307-127535-0024,24,speak up to the others ah the others returned john they're a nice lot ain't they you say this cruise is bungled ah by gum if you could understand how bad it's bungled you would see,1,1
3072-155948-0017,17,it was while hunting in vain for a grouse that i came on the bear and killed it as above described when i reached the settlement and went into the store the storekeeper identified me by remarking you're the tenderfoot that old hank was trundling ain't you,1,1
3083-7944-0057,57,there ain't nobody there to night and as near as i can make out there's three ewes and their lambs missing there ain't a bit of use in us trying to depend on pete i'll ride over on bear creek to morrow and see if i can get that fellow buck told us about,2,2
3083-7944-0060,60,difficult no there ain't nothing to do but tendin to the sheep the man has to stay at the ranch of nights though mister howitt was wondering what staying at the ranch nights could have to do with the difficulty,1,1
3083-7944-0070,70,it's no use honey said missus matthews breaking the silence it just ain't no use,1,1
3259-158083-0033,33,as they ran me past she was lying there with her arms out and we heard one of the men yell the suffrager my mother ain't no suffrager i'll put you through at the end of the corridor,1,1
3370-163384-0007,7,they held the candle and took a good look at me and all said why he ain't a shepherdsonno,1,1
3370-163384-0012,12,and he was dragging a gun along with the other one he says ain't they no shepherdsons around they said no twas a false alarm well he says,1,1
3370-163384-0019,19,and buttermilkthat is what they had for me down there and there ain't nothing better that ever i've come across yet buck and his ma and all of them smoked cob pipes except the nigger woman which was gone and the two young women,1,1
3370-163384-0049,49,in the realms of the good and great if emmeline grangerford could make poetry like that before she was fourteen there ain't no telling what she could a done by and by buck said she could rattle off poetry like nothing,1,1
3380-64298-0012,12,when he came to himself mary was binding up his arm what a fool i am he said trying to get up but yielding at once to mary's prevention ain't it ridic'lous now miss that a man of my size,1,1
3380-64298-0014,14,you have lost a good deal of blood her voice faltered she had been greatly alarmed and the more that she had not light enough to get the edges of the wound properly together you've stopped it ain't you miss i think so,1,1
3490-177641-0009,9,he sat eyes unfocused feeling the movement of animal life in the jungle around them on the way he said biggest thing i ver heard not a beast tween here and the mountains ain't howlin is lungs out runnin towards the city jason was aware of part of it,1,1
3493-17615-0015,15,but the man growled in a low tone shut up ain't you got no manners shirley prolonged that meal as much as music could do it for she had no relish for a more intimate tete a tete with either of her companions,1,1
3526-176653-0021,21,the girl shrank to the bushes but she cried sharply back don't you hurt him now dad he ain't even got a pistol he ain't no shet up,2,2
3536-8226-0007,7,of course it ain't said missus bozzle,1,1
3536-8226-0010,10,when a married woman has followers and the husband don't go the wrong side of the post too or it ain't proved again him that he do they'll never let her have nothing to do with the children,1,1
3536-8226-0011,11,i'll tell you what it is b exclaimed missus bozzle it's my belief as he ain't quite right up here and missus bozzle touched her forehead,1,1
3546-175390-0018,18,sleep dang likely now ain't it night sounds were becoming day sounds the far away hooting of freight engines seemed brisker than an hour ago in the dark,1,1
3691-178109-0025,25,pinning your ears back and jiu jitsing the fried chicken and then doing a high dive into a little dish that ain't that isn't either a wash bowl or real good lemonade,1,1
3691-178118-0028,28,claire thought of the still hand so still that she had seen under the edge of the upturned car she tried to speak while the woman raved on wrath feeding wrath thank god i ain't really his wife my husband is a fine man mister kloh,1,1
3691-178118-0031,31,and i ain't going to wait here any longer for that lying cheating mean talking,1,1
3738-176680-0046,46,and whenever he did speak she knew what he was going to say it's all over juny they've beat us on every turn they've got us one by one thar ain't but a few of us left now and when i git up if i ever do,1,1
3738-176682-0022,22,you might send me word uncle dan ahead so that he can't waylay me i'll do that very thing said the old man seriously i was joking uncle dan but i ain't the matter was out of hale's head before he got through the great gap,1,1
3744-177438-0021,21,who's rupe collins who is he echoed the fat faced boy incredulously say ain't you got any sense what say wouldn't you be just as happy if you had some sense,1,1
3744-177438-0026,26,yes he said feebly drawing back my name's penrod schofield then i reckon your father and mother ain't got good sense said mister collins promptly this also being formula why cause if they had they'd of give you a good name,1,1
3744-178590-0018,18,and i bet it ain't good for him come on said penrod closing the door that gave entrance to the stalls we got to get this horse some drinkin' water and some good food they tried whitey's appetite first with an autumnal branch that they wrenched from a hardy maple in the yard,1,1
3744-178590-0023,23,yes i will sam returned bitterly then as whitey had dragged the remains of the branch from the manger to the floor of the stall sam scrambled to the top of the manger and looked over there ain't much left to take away he's swallered it all except some splinters,1,1
377-129292-0029,29,but very neat and nicely made ingenious workman ain't he oliver very indeed sir said oliver at which mister charles bates laughed uproariously,1,1
3780-177784-0017,17,what's these places ain't they dark these are arbours where we as shrimps and tea i'll take you next saturday if you'll come a noisy band of young men followed by three or four girls ran across the bridge,1,1
3780-177788-0006,6,that my esther ain't a bad girl missus saunders sat nodding her head a sweet uncritical mother and esther understood how unselfishly her mother loved her and how simply she thought of how,1,1
3783-176659-0009,9,and the grizzled judge was speaking angrily this is the third time you've had this trial postponed because you hain't got no lawyer i ain't goin to put it off have you got you a lawyer now yes jedge said the defendant,1,1
3783-176659-0015,15,why don't somebody shoot he asked sarcastically you're a purty set o fools ain't you,1,1
3783-176659-0026,26,and one of the boys ran his eyes up boot and leg and if they were lifted higher hale could not tell whar'd you git him he squeaked the girl turned her head as the mule broke into a trot ain't got time to tell they are my cousins explained the girl,1,1
3783-176659-0044,44,maybe i am my name's hale the girl laughed well if this ain't the beatenest i've heerd june talk about you,1,1
3783-176659-0045,45,i reckon we'll see dave purty soon if this ain't the beatenest she repeated and she laughed again as she always did laugh it seemed to hale when there was any prospect of getting him into trouble,1,1
3783-176659-0059,59,whar again the temptation was too great talking to the falin who started the row this time the red fox wheeled sharply and his pale blue eyes filled with suspicion i keeps friends with both sides he said ain't many folks can do that i reckon not,1,1
3792-176660-0013,13,you told her you was comin back an ever'body told her you wasn't but that leetle gal al'ays said she knowed you was because you said you was she's growed some an if she ain't purty well i'd tell a man,1,1
3792-176660-0026,26,i got to get on back home said june rising no you ain't i bet you got dinner fer yo step mammy afore you left an i jes know you was aimin to take a snack with me an ole hon the little girl hesitated,1,1
3792-176660-0037,37,he ain't come back hyeh jes fer coal said ole hon shucks said uncle billy you women folks can't think bout nothin cept one thing he's too old fer her,1,1
3792-176660-0042,42,but she isn't as nice as you are he added quickly and the girl's quivering mouth steadied the tears stopped in her vexed dark eyes and she lifted them to him at last she ain't,1,1
3792-176660-0043,43,no indeed she ain't for a while they rode along again in silence june no longer avoided his eyes now and the unspoken question in her own presently came out,1,1
380-129064-0056,56,he ain't got manners but there's something about him and thus captain bragg showed that he possessed discrimination as a man as well as ability as a commander but a calm taking place when the ramchunder was within ten days sail of england,1,1
3807-4923-0032,32,come come sir returned the soldier sulkily this ain't the time to bully and as for mutiny why one man's about as good as another just now this speech from the lips of a man who,1,1
3819-134146-0058,58,put him to bed at once and give him a cooling draught i ain't been dreaming his exalted fatness remonstrated as the professor led him away bad grammar sir,1,1
3843-176663-0035,35,i've come over to take ye home you oughter be ashamed o yourself she said hotly and she turned to go back into the house oh you ain't ready now well git ready an we'll start in the mornin i'll be aroun fer ye,1,1
3843-176666-0064,64,why ye ain't a bit changed i knowed ye wasn't goin to put on no airs like dave thar said she turned on dave who with a surly shrug wheeled and went back into the store uncle billy was going home come down to see us right away now he called back,1,1
3853-163249-0033,33,no he ain't it's a trainer added ann lizy,1,1
3864-185126-0022,22,though exactly what he meant by that remark i did not gather they ain't got no sense he declared and what sense they has got don't do em no good i told him finally that i was from the north oh i knows it he exclaimed i knows it,1,1
3864-185126-0045,45,as i saw more of him i ain't de boss but i's got right smart to say,1,1
392-131210-0011,11,it ud be only a devil as would hurt him and there ain't so many o them as some folk ud have you believe a boy o diamond's size as can arness a oss t'other diamond's size and put him to right as a trivet,1,1
392-131210-0017,17,as the men arrived they all greeted him kindly and inquired after his father ain't you afraid of the old oss running away with you asked one no he wouldn't run away with me,1,1
392-131210-0022,22,just as well i daresay you're a pair of em but you are a rum un for a cabby ain't you now said the policeman i don't know as i ought to let you go i ain't done nothing,2,2
392-131210-0023,23,said diamond it's not my fault i'm no bigger i'm big enough for my age that's where it is said the man you ain't fit how do you know that asked diamond with his usual smile,1,1
392-131210-0033,33,well it ain't got no mouth sure enough but how then does it eat all day long it sucks in its food through the tiniest holes in its leaves he answered its breath is its food,1,1
392-131210-0036,36,he said at last ain't you a cabby then cabbies don't cheat,1,1
392-131210-0045,45,and i sees you too you'd better leave him alone he ain't no oyster he's a angel come down on his own business you be off or i'll be nearer you than quite agreeable the drunken cabman was a tall stout man,1,1
392-131210-0047,47,yes he is a friend o mine one o the best i ever had it's a pity he ain't a friend o yourn you'd be the better for it,1,1
3926-174988-0028,28,that no consideration should at present take him to tankerville we ain't going to charge you not one penny said mister gadmire with enthusiasm i feel all that i owe to the borough said phineas and to the warm friends there who have espoused my cause,1,1
3934-102415-0047,47,have you got your answer asked elizabeth no he said i ain't had time yet to go but i kind of wish somebody would think to bring the mail not many people pass here,1,1
3945-29110-0017,17,but he ain't trifled with not much we learn that the company have put a new engine on the seven o'clock train and newly upholstered the drawing room car throughout it spares no effort for the comfort of the traveling public,1,1
3945-29110-0048,48,followed in most instances by a hail to himself as a eneas with the inquiry where is old anchises at first he had replied dere ain't no such man but irritated by its senseless repetition,1,1
3982-178459-0002,2,sundayfied and made fit to dine with the wife's relatives how'd you like for me to be that young fella mamma the husband whispered he's one of the sons and there ain't but two left now,1,1
3994-156757-0039,39,that the sight nearly deprived me of my appetite mumps bite a pickle and see if it ain't so exclaimed a neighbor to whom georgia was showing her painful and swollen face true enough the least taste of anything sour produced the tell tale shock,1,1
4017-231846-0034,34,oh yes sir certainly sir wheezed missus bensusan rolling back up the narrow passage i beg your pardon sir for my forgetfulness but my head ain't what it ought to be i'm a lone widow sir and not over strong,1,1
4017-231846-0047,47,missus bensusan gasped like a fish out of water and patted her fat breast with her fat hand as though to give herself courage it is not like a gentleman to say that another gentleman's his friend when he ain't she said with an attempt at dignity,1,1
4148-134149-0033,33,have you ever happened to notice another professor something like me but different never shouted the gardener so loudly and violently that we all drew back in alarm there ain't such a thing,1,1
4226-185488-0022,22,diseased returned the old man wal she ain't anything else for she's had the rumatiz orfully for six months saying which he took his hat and left concluding that it was not worth while to keep on investigating any longer at that time,1,1
4262-14486-0037,37,you are an idiot because no man born of woman is strong enough to take liberties with his public even though they be which they ain't all you say they are but they don't know any better,1,1
4267-78186-0004,4,so i said to him one day minister said i how on airth do you manage to keep your fruit that's so exposed when no one else can't do it nohow why says he they are dreadfully pretty fruit ain't they,1,1
4267-78186-0014,14,here the clockmaker seeing the storm gathering stooped down suddenly and staring intently held out his hand and exclaimed well if that ain't a beautiful child come here my little man,1,1
4267-78186-0015,15,and shake hands along with me well i declare if that are little feller ain't the finest child i ever seed what not abed yet ah you rogue,1,1
4267-78186-0027,27,and i tell you there ain't one in a thousand that knows a grain about either on em you hear folks say oh such a man is an ugly grained critter he'll break his wife's heart jist as if a woman's heart was as brittle as a pipe stalk,1,1
4321-15217-0004,4,ain't that black one a beauty seems as if i could see his mane blow in the wind and hear him whinny to that small feller trotting down to see if he can't get over and be sociable how i'd like to take a rousin run round that meadow on the whole lot of em,1,1
4340-15220-0015,15,didn't we have a lively time going for the doctors and getting him home asked another boy looking as if he felt defrauded of the most interesting part of the anniversary because no accident had occurred ain't going to be fireworks either unless somebody's,1,1
4340-15220-0083,83,and i'll go home alone i ain't afraid sanch will take care of me if you won't answered bab stoutly what do you suppose your mother will say to you asked ben feeling much reproached by her last words,1,1
4422-283730-0051,51,there ain't no time there not as we reckons time but once you've been there,1,1
4423-29083-0023,23,you was a stranger to me a minute ago but you ain't now said another it's bread cast upon the waters it'll return after many days,1,1
4423-29084-0017,17,an deah lord good lord it ain't like yo mercy it ain't like yo pity,2,2
4423-29084-0035,35,dey ain't two mars clay days de same one de lord kin pear eberywhah in a second goodness,1,1
4481-17499-0041,41,three better girls never lived and i'll trust em anywhere besides that we aren't going to any of your confounded social functions we're going on a reg'lar picnic and if i don't give those girls the time of their lives my name ain't john merrick,1,1
4511-45512-0004,4,ain't seen you for the longest spell peterson entered and looked around where's johnny missus thompson he asked excitedly i've got some wonderful news now ain't that nice hetty exclaimed,2,2
4535-279852-0007,7,what's the use of standing here in the mud i'll walk you back to judson an you can tell yer story there i ain't believing you and i ain't disbelieving you turn around the way you was a going,2,2
4570-56594-0002,2,this ain't no great stock country says he to the old gentleman with the cane,1,1
4570-56594-0010,10,swearin says the old preacher is a terrible bad practice and there ain't no use in it nohow,1,1
4586-61758-0009,9,he's no more dead than you air only fented by the way he hev fit me i reck'n there ain't much the matter wi him no he continued after stooping down and giving a short examination,1,1
4586-61776-0009,9,thur's them in this settlement as ud do thet ef they ain't rustrained,1,1
4586-61776-0011,11,you may speak your mind freely then my mind air thet the man who hez dud this murder ain't maurice the mowstanger that's my own belief you know it already have you nothing more to communicate,1,1
4586-61776-0023,23,cousin he'd do that or any other villinous thing ef there war a reezun for it there ain't none as i kin think o,1,1
460-172359-0042,42,blue ones pink ones green ones with outlandish and fascinating names on them that ran clear from the mattawa to the hudson bay and right from the start he was confident of winning there ain't no difficulty to it he said,1,1
460-172359-0046,46,there was a good mine simply going to ruin for lack of common sense she ain't been developed jeff would say there's silver enough in her so you could dig it out with a shovel she's full of it but they won't get at her and work her,1,1
4680-16026-0035,35,it's a shame to miss this anyway two women an old fellow who lodges in the back yard and curtains that ain't so bad at the windows the old cove must be a jew,1,1
4681-13056-0034,34,that has ruined him what are we to do missus lopez i do not understand my husband's business missus parker you're one with him ain't you,1,1
4748-25901-0007,7,and when he tried to cheer himself up with a good whistle his lips trembled so they wouldn't pucker the poor dear's eyes could be cured i ain't a doubt,1,1
4748-25901-0037,37,doubt if it's enough to do the child any good and you need clothes and shoes and a heap of things let alone the books you hanker after so much it ain't likely you'll ever find another wallet,1,1
4788-294466-0023,23,pale fellar wi specs on is her son ain't he yes mister harvey dick is missus farley's son mary took time in a friendly way to satisfy the old man's curiosity,1,1
483-125116-0036,36,no time ain't been lost on any hand the police have put into print already and here's what the print says of it taking up the bottle with the lamp in it he held it near a paper on the wall with the police heading body found,1,1
483-125116-0046,46,i answer you simply most on em do you suppose there has been much violence and robbery beforehand among these cases i don't suppose at all about it returned gaffer i ain't one of the supposing sort,1,1
483-125126-0074,74,i can have no hesitation in replying it not being inconsistent with the public service that those accents were the accents of the t'other governor you've tolerable good eyes ain't you governor you've all tolerable good eyes ain't you,2,2
4841-26659-0060,60,i done brung him down an lef him in your shed an i lowed p'rhaps uncle jerry'd take him ovah to his paw again he swallowed and turned his face away the critter'd starve up yander anyhow i ain't hoss stealin,1,1
4848-29108-0009,9,bigger child why what's two hundred thousand dollars pocket money mere pocket money look at the railroad did you forget the railroad it ain't many months till spring it will be coming right along and the railroad swimming right along behind it,1,1
4848-29108-0014,14,aha my girl don't you see things ain't so dark are they now i didn't forget the railroad now just think for a moment just figure up a little on the future dead moral certainties,1,1
4848-29108-0020,20,he calls it sometimes one and sometimes the other just whichever levels off his sentence neatest i reckon but ain't it a ripping road though i tell you it'll make a stir when it gets along,1,1
4899-32639-0035,35,mercy on us she cried out it ain't to sleep in,1,1
4936-65528-0001,1,that's good i'm feeling so happy and delighted and i've been hankering for someone to tell it all to tell you about it well i guess i might as well it ain't any breach of confidence you didn't know anne douglas,1,1
4936-65528-0005,5,gilbert is my sister julia's son and a fine young fellow he is it ain't good manners to brag of your own relations but i'm always forgetting and doing it gil was a great pet of mine he was so bright and nice mannered everybody liked him,1,1
4936-65528-0013,13,i ain't very sure what that means i looked it up in the dictionary after james ebenezer left i wouldn't display my ignorance afore him but i can't say that i was much the wiser for it anyway it meant something real nice,1,1
4936-65528-0026,26,when a woman gets to the point where she can't give a gift of joy to anyone there ain't much use in her living i felt real old and worn out and useless i was sitting here under these very trees,1,1
4936-65528-0040,40,he arrived home yesterday and last night anne came to springdale on her way home from saint mary's they came to see me this morning and said things to me i ain't going to repeat because they would sound fearful vain,1,1
4957-30119-0010,10,were just getting ripe he showed the patch with much pride one day to the nieces saying here's the most extry fine melling patch in this county ef i do say it myself dan brayley he thinks he kin raise mellings but the ol fool ain't got a circumstance to this,1,1
