File,Line,Content,InstancesCountPerLine,FeatureCountPerLine
1025-92814-0019,19,i must make a prescription that is to be called for soon say said mc gowan looking up suddenly say ikey ain't there a drug of some kind,1,1
1027-125140-0026,26,which mister rokesmith just now read to me out aloud for i ain't good at handwritings offering to find me another little child to name and educate and bring up well this has set me thinking,1,1
1027-125147-0024,24,with a bottomless chair a lantern and a bunch of matches now old un cried fascination in his light raillery what dodgery are you up to next sitting there with your eyes shut you ain't asleep,1,1
103-1241-0027,27,who had been stolen away from her parents in her infancy by a cruel nurse who died before she could confess i used to lie awake at nights and imagine things like that because i didn't have time in the day i guess that's why i'm so thin i am dreadful thin ain't i there isn't a pick on my bones,1,1
1051-133883-0037,37,in one of the talks he had with nat about his chief temptation i know it and i don't mean to but it's so much easier to get along if you ain't very fussy about being exactly true,1,1
1051-133886-0028,28,never mind if she did it is awfully mean to hurt a little girl said demi reproachfully ho i don't mind i ain't a little girl i'm older than you and daisy so now cried nan ungratefully don't preach deacon you bully posy every day of your life,1,1
1061-152224-0014,14,small fear of it the gordons ain't sociable to say the least of it no sir mother pass the biscuits to the master who was the young fellow he had with him asked eric curiously neil neil gordon,1,1
1061-152224-0023,23,they say he ain't to be trusted further'n you can see him if as far it's certain he's awful hot tempered and one time when he was going to school he near about killed a boy he'd took a spite to choked him till he was black in the face and neil had to be dragged off,1,1
1061-152224-0026,26,but you're like old aunt nancy scott you never say anything uncharitable except in the way of business you know the gordons ain't like other people and never were and never will be they're about the only queer folks we have in lindsay master except old peter cook who keeps twenty five cats,1,1
107-22885-0037,37,and he ain't as popular now as he used to was well ain't it strange why aunt polly he was always so good and kind and moony and absent minded and chuckle headed and lovable why he was just an angel,2,2
107-22887-0031,31,and set down on the end of the sky light both of us knowed what that meant without having to explain to one another bud dixon would wake up and miss the swag and would come straight for us for he ain't afeard of anything or anybody that man ain't he would come and we would heave him overboard,2,2
107-22887-0032,32,or get killed trying it made me shiver because i ain't as brave as some people but if i showed the white feather well i knowed better than do that i kind of hoped the boat would land somers and we could skip ashore and not have to run the risk of this row,1,1
107-22887-0034,34,ain't it suspicious land hal says do you reckon he's playing us open the paper i done it and by gracious there warn't anything in it but a couple of little pieces of loaf sugar that's the reason he could set there and snooze all night so comfortable,1,1
1100-135264-0011,11,she ain't responsible for it and you ain't but it's there and neither of you can cross it my childhood wasn't very happy before i came to green gables said anne,2,2
1100-135264-0021,21,there's a vast of onunderstandable things in life ain't there mistress blythe sometimes things seem to work out real proper like same as with you and the doctor and then again they all seem to go catawampus,1,1
1121-176698-0015,15,said adam at this juncture speaking from beneath an inlaid table which he held balanced upon his head it ain't as if this was jest ordinary furnitur sir ye see she kind er feels as it be all part o dapplemere manor as it used to be called,1,1
1121-176698-0016,16,it's all been here so long that them cheers an tables has come to be part o the ouse sir so when she comes an finds as it ain't all been took,1,1
1265-135635-0023,23,lauk mary ann what's the matter said missus cluppins it's put me all over in such a tremble betsy replied missus raddle raddle ain't like a man he leaves everythink to me,1,1
1265-135635-0051,51,it's a gentleman said missus raddle well if it ain't mister jackson the young man from dodson and fogg's cried missus bardell why gracious surely mister pickwick can't have paid the damages or hoffered marriage said missus cluppins,1,1
1265-135635-0060,60,why really there ain't much time to lose replied jackson and i've got a friend here he continued looking towards the man with the ash stick oh ask your friend to come here sir said missus bardell pray ask your friend here sir,1,1
1265-135635-0066,66,sad thing about these costs of our people's ain't it said jackson when missus cluppins and missus sanders had fallen asleep your bill of costs i mean,1,1
1445-139387-0006,6,and when she found it she said to the blond twin who was now doing the biographies in his turn while the brunette one rested if it ain't asking what i ought not to ask mister angelo,1,1
1445-139397-0012,12,en sign some names to it en say you'll sell me cheap ca'se you's hard up you'll find you ain't gwine to have no trouble you take me up de country a piece en sell me on a farm,1,1
1445-139397-0013,13,dem people ain't gwine to ask no questions if i's a bargain tom forged a bill of sale and sold his mother to an arkansas cotton planter for a trifle over six hundred dollars,1,1
1469-163403-0003,3,at last i says this ain't no thirty seven year job this is a thirty eight year job tom sawyer he never said nothing but he sighed and pretty soon he stopped digging,1,1
1469-163403-0004,4,then he says it ain't no use huck it ain't a going to work if we was prisoners it would because then we'd have as many years as we wanted and no hurry and we wouldn't get but a few minutes to dig every day,2,2
1469-163403-0005,5,while they was changing watches and so our hands wouldn't get blistered and we could keep it up right along year in and year out and do it right and the way it ought to be done but we can't fool along we got to rush we ain't got no time to spare,1,1
1469-163403-0006,6,if we was to put in another night this way we'd have to knock off for a week to let our hands get wellcouldn't touch a case knife with them sooner well then what we going to do tom i'll tell you it ain't right and it ain't moral,2,2
1469-163403-0008,8,and as for me i don't care shucks for the morality of it nohow when i start in to steal a nigger or a watermelon or a sunday school book i ain't no ways particular how it's done so it's done,1,1
1469-163403-0011,11,if it warn't so i wouldn't approve of it nor i wouldn't stand by and see the rules brokebecause right is right and wrong is wrong and a body ain't got no business doing wrong when he ain't ignorant and knows better,2,2
1469-163403-0016,16,his hands was so sore at last he says it ain't no use it can't be done what you reckon i better do can't you think of no way yes i says but i reckon it ain't regular,2,2
1498-140041-0025,25,cousin cyrus is an old man an consid'able trouble but he thinks my teeth are handsome an says i've got a splendid suit of hair there ain't a person in lewiston that knows about the minister or father's will,1,1
1578-140045-0003,3,i tell you harriet beecher stowe herself couldn't a done it better justice i took it all in responded mister cobb who was pleased that mother agreed with him about rebecca i ain't sure but she's goin to turn out somethin remarkable,1,1
1578-140045-0004,4,land no mother there ain't no home'path bout miss parks she drives all over the country i can't see rebecca as a lady doctor somehow mused missus cobb her gift o gab is what's goin to be the makin of her,1,1
1746-143015-0033,33,ain't bigger nor a derringer,1,1
1746-143015-0067,67,eyeing the faces around him but it strikes me that this thing ain't exactly on the squar it's playing it pretty low down on this yer baby to ring in fun on him that he ain't goin to understand,2,2
1750-135624-0038,38,yes but that ain't all said sam again directing his master's attention to the coach door,1,1
177-122839-0007,7,ain't mister irving splendid he just worships the ground she treads on and it makes me feel so queer sometimes to see the look in his eyes when he's watching her it beggars description miss shirley ma'am i'm awful thankful they're so fond of each other it's the best way when all's said and done,1,1
1772-135621-0068,68,that ain't said jack hopkins is it bob nothing at all replied mister bob sawyer by the bye bob said hopkins with a scarcely perceptible glance at mister pickwick's attentive face,1,1
1809-143025-0022,22,and mounting a stump looked full in his face with big searching eyes you ain't mad said she with an interrogative shake of the black braids no nor bothered no nor hungry,1,1
1845-145083-0026,26,and i have miles word for it ain't any too glad to see him and shows it he phones for a taxi to go back to his hotel about nine fifteen that was miles says but decides to walk down the hill to meet it,1,1
1846-144458-0031,31,you take things so easy no use taking em otherwise my dear said mister omer no indeed returned his daughter we are all pretty gay here thank heaven ain't we father i hope so my dear said mister omer as i have got my breath now,1,1
1867-148436-0011,11,he sounds like a tenderfoot but he ain't a tenderfoot feeling that this parting shot gave him the honours of the meeting he turned away whistling with such spirit that one of his dogs overhearing stood still and gazed at his master,1,1
1867-154071-0007,7,by this time the nerves of the two watchers were shattered by the constant strain and the monotonous view from the front window was beginning to madden them it's proof that she ain't yonder said bill gregg,1,1
1867-154071-0008,8,and he grew pale at the thought partner said ronicky doone if they are trying to keep her away from us they sure have the sense to keep her under cover for as long as two days ain't that right,1,1
1867-154071-0032,32,said gregg huskily ain't there that's where you and me don't agree,1,1
1867-154071-0034,34,ain't that something done after you've done all that,1,1
1867-154075-0039,39,i ain't terrible backward with the trigger finger john mark not that i figure on bragging but i want you to pick good men for my trail and tell em to step soft is that square,1,1
188-136483-0019,19,old tom chuckled well it strikes me miss polly herself ain't lookin none the worse for wearin them ere curls round her forehead he observed dryly course she ain't retorted nancy indignantly,2,2
188-136483-0021,21,nancy shrugged her shoulders oh she ain't handsome of course but i will own up she don't look like the same woman what with the ribbons an lace jiggers miss pollyanna makes her wear round her neck,1,1
188-136483-0023,23,well i guess ye won't then from me oh mister tom come on now wheedled the girl ye see there ain't many folks here that i can ask maybe not but there's one anyhow that ain't answerin,2,2
188-136483-0025,25,there ain't no special diff'rence as i can see or anybody i guess she jest lays there an sleeps an talks some an tries ter smile an be glad cause the sun sets or the moon rises or some other such thing,1,1
188-136483-0028,28,cause i was already bent part way over nancy gave a wistful laugh well i ain't surprised after all you might know she'd find somethin we've been playin it that game since almost the first,1,1
188-141613-0034,34,and you've known me ever since repeated jimmy but in a far different voice jimmy had suddenly come back to the present and to his grievance but then i ain't jamie you know he finished with scornful emphasis,1,1
1901-48014-0006,6,they'd give yer prizes for size an numbers an speed i guess why say they're real crowded for room the plants ain't give em enough leaves to roost on have you tried bug death,1,1
1944-159227-0012,12,but he would not hear lucindy blamed and said quickly she ain't my wife yet but we calk'lated to be married in a month or so,1,1
1944-159228-0010,10,ain't this luck now gasped joe as gratefully as if that hospital cot was a bed of roses what is the matter a wound in the head and arm i asked,1,1
1944-159228-0022,22,she ain't no folks of her own nor much means and ought to marry a man who can make things easy for her guess i'll have to wait a spell longer before i say anything to lucindy about marryin now,1,1
1944-159230-0015,15,there ain't much left of me but bones and pain ma'am i'm powerful glad to see you all the same dust off a chair patsey and let the lady set down,1,1
1944-159230-0017,17,but you hadn't got back and then somehow i thought i was goin to be mustered out for good and so wouldn't trouble nobody but my orders ain't come yet and i am doing the fust thing that come along,1,1
1944-159230-0018,18,it ain't much but the good soul stood by me and i ain't ashamed to pay my debts this way sence i can't do it in no other,2,2
1944-159230-0031,31,i can hobble some but i ain't got used to bein a scarecrow yet and joe glanced from the hose without heels that hung on the line to the ragged suit he wore with a resigned expression,1,1
1961-149739-0004,4,first i thought i'd take me hatchet and cut it down for it ain't thicker than me upper arm then i remembered how it was blooming in the spring and filling all the air with sweetness the coloring of the blossoms is beautiful and i hated to be killing it,1,1
1970-26100-0026,26,motioning the angry jackson away he he set down at de table but he ain't eat none the boy stuttered what do you mean george,1,1
1970-26100-0027,27,ah brung him some soup but he got up powful sudden lak he had a call to de telephome an he ain't come back are you sure of that george yas suh,1,1
1970-26100-0028,28,ah ast him did he want dinnah aftah he come back but he say he ain't hongry what time was it when he came back i asked,1,1
1985-144468-0090,90,ain't i what said the gentleman behind bred them suffolk punches by wholesale,1,1
1985-144468-0101,101,well now said the waiter in a tone of confidence what would you like for dinner young gentlemen likes poultry in general have a fowl i told him as majestically as i could that i wasn't in the humour for a fowl ain't you said the waiter,1,1
1998-29454-0016,16,ain't bad when she's in a good temper,1,1
1998-29454-0017,17,that ain't what she'll be in when you gets back,1,1
1998-29454-0021,21,i ain't it yer have i like what yer aunt do,1,1
1998-29454-0034,34,wild ones ain't alf the size i lay,1,1
1998-29455-0025,25,which this ain't not by no means,1,1
1998-29455-0030,30,i ain't sure as i adn't better stick to the road and keep away from old ands like you jim,1,1
1998-29455-0032,32,if e's straight e'll do for me and if he ain't i'll do for im see,1,1
2003-143254-0029,29,i should say about twenty five feet why we ain't four foot above it now and look there,1,1
2053-138901-0034,34,you know you put it into my head your own self pleaded mister cheesacre didn't you now but things are so different since that said the widow how different i ain't different,1,1
2053-138901-0050,50,i have heard so much of mister cheesacre but have never seen him kate suggested that she should get into the gig and drive after him he ain't a been and took hisself off suggested the boy whose face became very dismal as the terrible idea struck him,1,1
207-131203-0018,18,though to be sure said diamond's father with what truth i cannot say but he believed what he said some ladies is very hard and keeps you to the bare sixpence a mile when every one knows that ain't enough to keep a family and a cab upon to be sure it's the law,1,1
2085-147970-0017,17,i hope your grandpa ain't lose no stacks no we did n't i came to ask you something tony grandmother wants to know if you can't go to the term of school that begins next week over at the sod schoolhouse she says there's a good teacher and you'd learn a lot,1,1
2085-147970-0018,18,antonia stood up lifting and dropping her shoulders as if they were stiff i ain't got time to learn i can work like mans now my mother can't say no more how ambrosch do all and nobody to help him i can work as much as him,1,1
2085-147971-0007,7,this what you want he asked surlily jake jumped off his horse i saw a wave of red come up under the rough stubble on his face that ain't the piece of harness i loaned you ambrosch or if it is you've used it shameful,1,1
2085-147971-0008,8,i ain't a going to carry such a looking thing back to mister burden ambrosch dropped the collar on the ground all right he said coolly took up his oil can and began to climb the mill jake caught him by the belt of his trousers and yanked him back,1,1
2085-147971-0015,15,these foreigners ain't the same you can't trust em to be fair it's dirty to kick a feller you heard how the women turned on you,1,1
2085-147971-0016,16,they ain't to be trusted i don't want to see you get too thick with any of em,1,1
2085-147971-0046,46,jake laughed sheepishly i don't want to have no trouble with ambrosch if he'll let me alone i'll let him alone if he slap you we ain't got no pig for pay the fine she said insinuatingly,1,1
210-129396-0113,113,luck or one's neighbor in the days of astrology it was customary to unload it upon a star alas things ain't what we should see if eve had let that apple be and many a feller which had ought,1,1
2254-152826-0020,20,till at last i said it ain't no use he's froze too hard to thaw he's obstinate and he won't lie straight so i guess i got to saw so i sawed off poor bill's arms and legs,1,1
226-122538-0014,14,seven pence apenny of this stuff ain't much for carrying all that along i don't think grumbled his mate and jane's young porter experienced the double joy of faith confirmed and willing service generously rewarded a telegraph boy walked along the train saying,1,1
2285-163380-0029,29,there ain't no sense in it go for the steam ferry now if you'll go and,1,1
2285-163381-0031,31,shucks it ain't calling you anything it's only saying do you know how to talk french well den why couldn't he say it why he is a saying it,1,1
2285-163381-0034,34,does a cat talk like a cow or a cow talk like a cat no dey don't it's natural and right for em to talk different from each other ain't it course and ain't it natural and right,2,2
2297-28913-0021,21,i am sorry for it i can say nothing else you ain't so sorry for it as i am oh no you can never be that my lord after all what does it matter to you,1,1
2297-28913-0031,31,i ain't said it all yet he's here in london who's here green he's here he doesn't think that i know but i could lay my hand on him to morrow,1,1
2309-167347-0015,15,we gotta travel a piece yet say jake be you a man or be you a poor dumb critter what ain't got no spunk,1,1
2341-163407-0027,27,his eyes just blazed and he says no is that so ain't it bully why huck if it was to do over again,1,1
2341-163408-0039,39,and as for that sheet they made the rag ladder out of ther ain't no telling how many times they didn't steal that and flour and candles and candlesticks and spoons,1,1
2341-163408-0051,51,and the door ain't locked and you she stopped looking kind of wondering and then she turned her head around slow and when her eye lit on me i got up and took a walk,1,1
2341-163408-0058,58,no you won't she says you'll stay right wher you are one's enough to be lost at a time if he ain't here to supper your uncle ll go well,1,1
2341-163408-0066,66,and when she was going away she looked down in my eyes so steady and gentle and says the door ain't going to be locked tom and there's the window and the rod,1,1
2393-144496-0059,59,to keep off seeing me for though she ain't no call to doubt my love and doen't and doen't,1,1
2405-148581-0022,22,he held the oriental toy against the light oh i ain't a judge but now and then i like to pick up a pretty thing ralph noticed that his eyes caressed it well now let's talk,1,1
2445-148556-0035,35,funny to think of ain't it undine recovering herself held out her hand impulsively i'm real glad of it i mean i'm real glad,1,1
2445-148556-0057,57,i ain't going to interrupt the wedding march he began to whistle a bar of lohengrin i only just want one little promise in return,1,1
2532-163402-0002,2,there ain't no watchman to be druggednow there ought to be a watchman there ain't even a dog to give a sleeping mixture to and there's jim chained by one leg with a ten foot chain to the leg of his bed,2,2
2532-163402-0013,13,ain't necessity enough for it for what i says,1,1
2532-163402-0014,14,why there ain't no necessity for it and what would you want to saw his leg off for anyway well some of the best authorities has done it they couldn't get the chain off so they just cut their hand off and shoved and a leg would be better still but we got to let that go,1,1
2532-163402-0015,15,there ain't necessity enough in this case and besides jim's a nigger and wouldn't understand the reasons for it and how it's the custom in europe so we'll let it go but there's one thinghe,1,1
2532-163402-0016,16,why tom sawyer how you talk i says jim ain't got no use for a rope ladder he has got use for it how you talk you better say you don't know nothing about it,1,1
2532-163402-0028,28,the iron mask always done that and it's a blame good way too jim ain't got no tin plates they feed him in a pan that ain't nothing we can get him some can't nobody read his plates,2,2
2532-163402-0029,29,that ain't got anything to do with it huck finn all he's got to do is to write on the plate and throw it out you don't have to be able to read it,1,1
2532-163402-0031,31,but it's somebody's plates ain't it well spos'n it is what does the prisoner care whose he broke off there because we heard the breakfast horn blowing so we cleared out for the house,1,1
2532-163402-0038,38,why to dig with we ain't a going to gnaw him out are we ain't them old crippled picks and things in there good enough to dig a nigger out with i says he turns on me looking pitying enough to make a body cry and says,2,2
2532-163402-0046,46,because it mayn't take very long for uncle silas to hear from down there by new orleans he'll hear jim ain't from there then his next move will be to advertise jim or something like that so we can't resk being as long digging him out as we ought to,1,1
2532-163402-0049,49,now there's sense in that i says letting on don't cost nothing letting on ain't no trouble and if it's any object i don't mind letting on we was at it a hundred and fifty year,1,1
2544-27475-0005,5,don't bother your head it ain't the best part of you about things that can't be helped we're not the only horses that can't be kept on the course,1,1
2552-132097-0110,110,i ain't afraid of robbers he declared strutting up and down when they come i shall just cut them in two with my sword which papa gave me they did come once i did cut them in two three five eleven of em you'll see,1,1
2573-178450-0006,6,he'll go back to the machine he couldn't learn to tend properly in the six months he was there and he'll stick to it till he does learn it do you suppose that lummix ever asked himself why i want him to learn it no and i ain't a goin to tell him either,1,1
2573-178450-0008,8,now labor ain't any more a simple question than what it was when we were young my idea is that outside o union troubles the man that can manage workin' men is the man that's been one himself,1,1
2573-178450-0017,17,but it's frothin and bubblin in the boiler this country's been fillin up with it from all over the world for a good many years and the old camp meetin days are dead and done with church ain't what it used to be nothin's what it used to be,1,1
2573-178450-0024,24,this is the business man's day it used to be the soldier's day and the statesman's day but this is ours and it ain't a sunday to go fishin' it's turmoil turmoil,1,1
2606-132102-0079,79,and brood upon my breast that's sweet ain't it hasn't he reformed said clover he writes as if he had reformed,1,1
264-121332-0083,83,ain't she beautiful enter a floor walker silence till he moves forward smirking society person ain't she yeah but poor now i guess so they say,2,2
264-121332-0084,84,gee girls ain't she some kid and clara beamed on all alike amory believed that tradespeople gave her discounts sometimes to her knowledge and sometimes without it he knew she dressed very well,1,1
273-129288-0011,11,i will directly sir replied oliver undoing the chain and turning the key i suppose yer the new boy ain't yer said the voice through the key hole yes sir replied oliver how old are yer inquired the voice,1,1
2769-176256-0022,22,and as for the slant of the light on the glass there ain't much glass for the light to slant on i saw him peeping through that bottom broken pane on your left hand as plainly as i see you,1,1
2769-176256-0023,23,he's at the back ain't there a cupboard nor nothing where he could hide the cabman's manner was so extremely earnest that i went myself to see there was a cupboard on the landing but the door of that stood wide open and that obviously was bare,1,1
2769-176256-0031,31,but for you to say that he wasn't there and never had been blimey that cops the biscuit if he wasn't there all i can say is i ain't here and my orse ain't here and my cab ain't neither damn it the house ain't here and nothing ain't,5,5
2769-176256-0036,36,how am i to know what the thing's called i ain't up in foreign languages,1,1
2769-176263-0007,7,i thought you never was a comin that i did she recognised the inspector it's you mister phillips is it perceiving us she drew a little back who's them ere parties they ain't coppers,1,1
